{"date": "2026-07-22", "rung": "put/order/rand", "hypothesis": "B3: replace the dirty store's HashMap + Box-per-page with an arena/pool and drop the per-commit sort.", "outcome": "abandoned", "notes": "Parked on profile evidence (PERF-GAP B3): in the milli write-phase call tree the dirty-store probe was under the noise bar, and the Box is load-bearing for TXN-41 frame-address stability. Re-open only if a profile (EBS commit path included) names it."}
{"date": "2026-09-10", "rung": "del/bulk/half", "hypothesis": "B8: fuse remove_cell's pointer-adjust loop into one bounds-narrowed pass (LMDB's loop shape).", "outcome": "reverted", "notes": "Disproved: 23.8 ms vs 21.3 ms, slower. copy_within beats per-element indexing. The cost is the NUMBER of cell operations per delete, not per-element checks (PERF-GAP B8)."}
{"date": "2026-09-10", "rung": "del/bulk/half", "hypothesis": "B8: rebalance moves several entries per borrow, or a move_entry primitive writes the destination cell straight from the source page, avoiding the remove_cell + insert_cell round-trip.", "outcome": "blocked-adr", "notes": "Diagnosed: 25k deletes issue 63,542 cell removals and 44,041 insertions. A real design change to rebalance: ADR first (PERF-GAP B8)."}
{"date": "2026-09-25T10:11:48+00:00", "rung": "del/cursor/drain", "hypothesis": "B8a: RwCursor::del_current re-descends twice per entry; leaving the cursor positioned after a delete (C_DEL-style) removes both descents.", "outcome": "kept", "verdict": "improved", "base": "a8faeb7b8621b060cfd0ced36651e30e5bf40294", "host": "Linux x86_64", "rounds": 3, "rungs": [{"rung": "del/cursor/drain", "state": "improved", "ratio_vs_lmdb_before": 3.8133289974673317, "ratio_vs_lmdb_after": 3.115456755378396, "speedup": 0.8052623698022285}], "notes": "Measured on the bench server (Xeon E3-1230v2, turbo off, 3 rounds): cursor/drain 0.805x of before, other del/* flat, LMDB drift <= 1.6%. Change still staged, not committed, at measurement time. cursor/drain / range/half went 1.39 -> 1.14 here, not the 1.01 the laptop note in BENCH-MAP claims."}
{"date": "2026-09-25T14:08:17+00:00", "rung": "env/txn/rw_empty_commit", "hypothesis": "WriterGuard::drop's unconditional notify_one is a futex_wake syscall per write txn on Linux; LMDB avoids it with a pthread me_wmutex that only enters the kernel under contention; a waiter count under the flag mutex makes ZeroDB notify only when a writer is parked.", "outcome": "kept", "commit": "7c02a5c", "verdict": "invalid", "base": "9628f90fdc972727e0dd8c7fd37260207220d02a", "host": "Linux x86_64", "rounds": 5, "rungs": [{"rung": "env/txn/rw_empty_commit", "state": "unreliable", "ratio_vs_lmdb_before": 5.933042898101597, "ratio_vs_lmdb_after": 2.1853557325312822, "speedup": 0.3803908154713502}], "notes": "Kept on Quentin's override: bench-ab said invalid (LMDB drift 1.032, limit 0.03) but futex calls went 1,401,099 -> 31 (= LMDB) and ZeroDB moved 0.380x in all 5 rounds. rw_empty_commit 5.93x -> 2.19x; commit/batch flat. Remaining gap: write_txn / RwTxn drop / clone_snapshot."}
{"date": "2026-09-25T17:10:20+00:00", "rung": "scan/edge/first_last", "hypothesis": "RoTxn::record_for takes a Mutex and scans a Vec on every named-DB read; LMDB indexes a per-txn mt_dbs[dbi] array filled lazily; a dbi-indexed OnceLock<DBRecord> table does the same lock-free.", "outcome": "kept", "commit": "f82922a", "verdict": "improved", "base": "e73c177c8394700fed1ef0eb45c8090c325663cd", "host": "Linux x86_64", "rounds": 3, "rungs": [{"rung": "get/access/hot", "state": "flat", "ratio_vs_lmdb_before": 1.3226986123631546, "ratio_vs_lmdb_after": 1.3388590081330676, "speedup": 1.0122177460676705}, {"rung": "get/access/miss", "state": "improved", "ratio_vs_lmdb_before": 1.7585708136170533, "ratio_vs_lmdb_after": 1.6306191868003352, "speedup": 0.9272411290884868}, {"rung": "scan/edge/first_last", "state": "improved", "ratio_vs_lmdb_before": 2.383898216488171, "ratio_vs_lmdb_after": 2.218988244132463, "speedup": 0.9042905684899688}], "notes": "first_last 0.904 (3 rounds) / 0.892 (breadth); scan/meta/len 2.46x -> 1.01x (record resolution alone, now at parity). Hypothesis half-wrong: get/access/hot flat, so the per-get gap is the per-page descent (node_view 17 %, ValidatedPages::contains 10.5 % of first_last), not handle resolution."}
{"date": "2026-09-25T22:33:25+00:00", "rung": "put/gc/drain_big", "hypothesis": "GC draws hand out the smallest id with Vec::drain(0..1), an O(L) memmove per page, so draining one entry is O(L^2); LMDB pops from the tail of a reverse-sorted me_pghead; a head offset per drain entry makes the front pop O(1) with byte-identical GC-20 output.", "outcome": "reverted", "verdict": "regressed", "base": "0188f9edbbd66ccf1355c4a3ee62a9ef08ca0c04", "host": "Linux x86_64", "rounds": 5, "rungs": [{"rung": "put/gc/drain_big", "state": "improved", "ratio_vs_lmdb_before": 2.2628589632904634, "ratio_vs_lmdb_after": 1.7339326306757818, "speedup": 0.7630242055576851}, {"rung": "put/order/seq", "state": "regressed", "ratio_vs_lmdb_before": 1.056578566394292, "ratio_vs_lmdb_after": 1.1486470082071139, "speedup": 1.087138282699617}], "notes": "Target confirmed: put/gc/drain_big 0.763 (+-0.031, 5 rounds), 2.26x -> 1.73x vs LMDB. Reverted per the loop rule: every other put/del rung got 1.4-8.7% slower with LMDB flat (put/order/seq 1.087 +-0.052 confirmed; api/plain 1.030, over/same_size 1.032, val/v256 1.039, del/bulk/half 1.014). Those rungs never drain a large entry, so the logic is unchanged there; nm shows allocate shrank 4276 -> 3801 B and commit grew 8782 -> 9165 B, i.e. codegen/layout of the write path moved. Gate was fully green (95 test bins, crash-test, stress, miri, fuzz). Patch kept at benches-server/research/attempt-1a-gc-head-offset.patch. Retry after the #8 codegen gate (e.g. #[inline(never)] on the GC draw so the hot allocate path keeps its old shape), measured at CGU1 and CGU16."}
{"date": "2026-09-26T02:35:57+00:00", "rung": "get/access/hot", "hypothesis": "B13: hot read-path bodies sit above LLVM's inlining threshold; moving the memo-miss/full-validation arms of leaf_view_over/branch_view_over into #[cold] #[inline(never)] fns and marking node_view, *_view_over, ValidatedPages::contains, bytes_from_classified #[inline] lets the default build inline the hit path (LMDB: tiny static page-lookup helpers).", "outcome": "reverted", "verdict": "regressed", "base": "35b5b480f4ee94742ba8437524cad88d25af4c8d", "host": "Linux x86_64", "rounds": 3, "rungs": [{"rung": "get/access/hot", "state": "flat", "ratio_vs_lmdb_before": 1.3583823744334185, "ratio_vs_lmdb_after": 1.3734282134904494, "speedup": 1.0094349910869775}, {"rung": "get/db/named", "state": "flat", "ratio_vs_lmdb_before": 1.532051587699323, "ratio_vs_lmdb_after": 1.559462410012333, "speedup": 1.0178915791955627}, {"rung": "put/val/v8", "state": "regressed", "ratio_vs_lmdb_before": 1.420596244537619, "ratio_vs_lmdb_after": 1.538378804271235, "speedup": 1.0879125606308289}, {"rung": "scan/edge/first_last", "state": "unreliable", "ratio_vs_lmdb_before": 2.1897345056075888, "ratio_vs_lmdb_after": 2.216796776480609, "speedup": 1.0145273966234492}, {"rung": "seek/ge/rand", "state": "flat", "ratio_vs_lmdb_before": 1.4367207314620536, "ratio_vs_lmdb_after": 1.4690595718853028, "speedup": 1.0225805846886127}], "notes": "CGU16: all 41 rungs flat (targets 0.991-1.023). CGU1: 39 flat, put/val/v8 1.088 slower, most rungs +1-2 %. #[inline] only makes a fn eligible; LLVM's cost model still declined. Evidence for the next lever, from nm of the codegen-gate builds (CGU1 vs CGU1+inline-threshold=1000): inlined away at threshold 1000 are heed_zerodb::Database::get, node_view, Source::bytes_from_classified, ValidatedPages::contains, BranchRef::child_index_with, Cursor::leaf_at, read_and_check_bounds, OverflowRef::new, leaf_cell_len. Next: #[inline(always)] on exactly those (sub-lever 8b.2). Patch: benches-server/research/attempt-8b1-cold-view-arms.patch."}
{"date": "2026-09-26T05:52:24+00:00", "rung": "scan/edge/first_last", "hypothesis": "B13: nine hot read-path helpers stay out of line at LLVM's default threshold (nm diff of CGU1 vs CGU1+threshold 1000); LMDB's equivalents are small static functions the C compiler inlines; forcing exactly those with #[inline(always)] captures the gain without an LLVM flag.", "outcome": "kept", "commit": "eb450ac", "verdict": "improved", "base": "994a05c894a1045efafe186838f51f23d96d42c2", "host": "Linux x86_64", "rounds": 3, "rungs": [{"rung": "get/access/hot", "state": "improved", "ratio_vs_lmdb_before": 1.3693257605911746, "ratio_vs_lmdb_after": 1.1112991267343657, "speedup": 0.8079181673474798}, {"rung": "get/access/miss", "state": "improved", "ratio_vs_lmdb_before": 1.6984149118914091, "ratio_vs_lmdb_after": 1.3435864503213857, "speedup": 0.7887697276174573}, {"rung": "get/access/rand", "state": "improved", "ratio_vs_lmdb_before": 1.5465371761651632, "ratio_vs_lmdb_after": 1.3293149528461694, "speedup": 0.8613113975787352}, {"rung": "get/access/seq", "state": "improved", "ratio_vs_lmdb_before": 1.4789252472954908, "ratio_vs_lmdb_after": 1.2283547817331026, "speedup": 0.8297209234626484}, {"rung": "get/db/named", "state": "improved", "ratio_vs_lmdb_before": 1.5624877417867573, "ratio_vs_lmdb_after": 1.3330238738292273, "speedup": 0.8502223445131036}, {"rung": "get/db/named_x8", "state": "improved", "ratio_vs_lmdb_before": 1.6259557013554153, "ratio_vs_lmdb_after": 1.3688888352985409, "speedup": 0.8418979890764671}, {"rung": "get/db/root", "state": "improved", "ratio_vs_lmdb_before": 1.5780349317817775, "ratio_vs_lmdb_after": 1.3389633131257532, "speedup": 0.8480930554574708}, {"rung": "get/key/k128", "state": "improved", "ratio_vs_lmdb_before": 1.4399258662998267, "ratio_vs_lmdb_after": 1.294449218030141, "speedup": 0.8989693485793705}, {"rung": "get/key/k32", "state": "improved", "ratio_vs_lmdb_before": 1.5660675768360144, "ratio_vs_lmdb_after": 1.3804293181301308, "speedup": 0.8828560405742151}, {"rung": "get/key/k8", "state": "improved", "ratio_vs_lmdb_before": 1.5581162325250117, "ratio_vs_lmdb_after": 1.3395714365388534, "speedup": 0.8630571236849321}, {"rung": "get/size/n1k", "state": "improved", "ratio_vs_lmdb_before": 1.4263585694024452, "ratio_vs_lmdb_after": 1.1870985217890073, "speedup": 0.8353335366076623}, {"rung": "get/size/n50k", "state": "improved", "ratio_vs_lmdb_before": 1.5468094665851249, "ratio_vs_lmdb_after": 1.3342455059151983, "speedup": 0.8643246046338915}, {"rung": "get/val/v256", "state": "improved", "ratio_vs_lmdb_before": 1.42670123762699, "ratio_vs_lmdb_after": 1.1826882767865763, "speedup": 0.8268007686773012}, {"rung": "get/val/v2page", "state": "improved", "ratio_vs_lmdb_before": 1.765130530043409, "ratio_vs_lmdb_after": 1.5569923841058801, "speedup": 0.8751064112771643}, {"rung": "get/val/v2page_touch", "state": "improved", "ratio_vs_lmdb_before": 1.5050363673790137, "ratio_vs_lmdb_after": 1.3541016413198195, "speedup": 0.8948358516833752}, {"rung": "get/val/v4k", "state": "improved", "ratio_vs_lmdb_before": 1.8244480826114136, "ratio_vs_lmdb_after": 1.5925940456670165, "speedup": 0.8729182599635644}, {"rung": "get/val/v4k_touch", "state": "improved", "ratio_vs_lmdb_before": 1.5262455918432598, "ratio_vs_lmdb_after": 1.367148581819555, "speedup": 0.8942109579069524}, {"rung": "get/val/v8", "state": "improved", "ratio_vs_lmdb_before": 1.3908224996718423, "ratio_vs_lmdb_after": 1.1756975712332587, "speedup": 0.8488242682290705}, {"rung": "get/val/v8_touch", "state": "improved", "ratio_vs_lmdb_before": 1.386546781996436, "ratio_vs_lmdb_after": 1.1732469507115986, "speedup": 0.8499789092245801}, {"rung": "put/api/plain", "state": "improved", "ratio_vs_lmdb_before": 1.226067777482757, "ratio_vs_lmdb_after": 1.095610896781628, "speedup": 0.8920108828894481}, {"rung": "put/api/reserved", "state": "improved", "ratio_vs_lmdb_before": 1.327799471426058, "ratio_vs_lmdb_after": 1.1785984747382978, "speedup": 0.8876328844087292}, {"rung": "put/order/append", "state": "improved", "ratio_vs_lmdb_before": 1.7360646127379833, "ratio_vs_lmdb_after": 1.5557723916922388, "speedup": 0.8931713690884802}, {"rung": "put/order/rand", "state": "improved", "ratio_vs_lmdb_before": 1.2030647755070796, "ratio_vs_lmdb_after": 1.113952884883209, "speedup": 0.9250812204060825}, {"rung": "put/order/seq", "state": "improved", "ratio_vs_lmdb_before": 1.2328996920967206, "ratio_vs_lmdb_after": 1.0953372664021759, "speedup": 0.8867643675382879}, {"rung": "put/over/grow", "state": "improved", "ratio_vs_lmdb_before": 1.385317641533507, "ratio_vs_lmdb_after": 1.3302902507287278, "speedup": 0.9596307658673642}, {"rung": "put/over/same_size", "state": "improved", "ratio_vs_lmdb_before": 1.4048419458288361, "ratio_vs_lmdb_after": 1.2373122066301057, "speedup": 0.8805789351109437}, {"rung": "put/val/v256", "state": "improved", "ratio_vs_lmdb_before": 1.2622990398052563, "ratio_vs_lmdb_after": 1.1268827455045, "speedup": 0.8952000642723723}, {"rung": "put/val/v8", "state": "improved", "ratio_vs_lmdb_before": 1.4365972707747037, "ratio_vs_lmdb_after": 1.2936922716036034, "speedup": 0.9026671533020958}, {"rung": "scan/edge/first_last", "state": "improved", "ratio_vs_lmdb_before": 2.2154750511462833, "ratio_vs_lmdb_after": 1.5642527590620283, "speedup": 0.7062465039441242}, {"rung": "scan/full/fwd", "state": "improved", "ratio_vs_lmdb_before": 2.036611507377806, "ratio_vs_lmdb_after": 1.7790255922746225, "speedup": 0.8741769804185022}, {"rung": "scan/full/rev", "state": "improved", "ratio_vs_lmdb_before": 1.7972504447322175, "ratio_vs_lmdb_after": 1.683088384189442, "speedup": 0.9363375085301936}, {"rung": "scan/prefix/bucket", "state": "improved", "ratio_vs_lmdb_before": 2.832605311480374, "ratio_vs_lmdb_after": 2.406754055320788, "speedup": 0.8497742201389632}, {"rung": "scan/range/10pct", "state": "improved", "ratio_vs_lmdb_before": 2.165737434594973, "ratio_vs_lmdb_after": 1.8229620315793238, "speedup": 0.8408159030812764}, {"rung": "scan/range/1pct", "state": "improved", "ratio_vs_lmdb_before": 2.2618078439995477, "ratio_vs_lmdb_after": 1.9026493623582175, "speedup": 0.8407624310957454}, {"rung": "seek/ge/gap", "state": "improved", "ratio_vs_lmdb_before": 1.454235722552842, "ratio_vs_lmdb_after": 1.2973665807560424, "speedup": 0.8926037676222419}, {"rung": "seek/ge/rand", "state": "improved", "ratio_vs_lmdb_before": 1.4562794329012752, "ratio_vs_lmdb_after": 1.2743827779783607, "speedup": 0.8750949503142192}, {"rung": "seek/ge/seq", "state": "improved", "ratio_vs_lmdb_before": 1.5474413411051833, "ratio_vs_lmdb_after": 1.3296510234089614, "speedup": 0.8592577877358013}], "notes": "CGU1: 37 improved, 0 regressed (get/access/hot 0.808, scan/edge 0.706, put/order/seq 0.887). CGU16: 31 improved, 0 regressed (verdict ab-20260926T025228Z). Breadth del/commit/mixed/env at CGU1: no regression. The fixture-drop harness fix exposes del/clear/all at 12x (197 us vs 2.36 ms), which raises #5a (leaf-skipping clear)."}
{"date": "2026-09-26T08:51:48+00:00", "rung": "put/gc/drain_big", "hypothesis": "Vec::drain(0..1) per GC draw is O(L^2) per free-list entry; LMDB cuts from the tail of a reverse-sorted list; a consumed-prefix offset makes the front draw O(1). Retry of the reverted attempt with the draw arms kept #[inline(never)] so allocate's hot shape does not move.", "outcome": "kept", "commit": "37b03c9", "verdict": "improved", "base": "bc4eba38bb11c5ffc18bad7c5b6aa25360005895", "host": "Linux x86_64", "rounds": 3, "rungs": [{"rung": "put/gc/drain_big", "state": "improved", "ratio_vs_lmdb_before": 2.233092507775809, "ratio_vs_lmdb_after": 1.7020428710419315, "speedup": 0.762190937059383}], "notes": "CGU1 verdict attached (0.762, 2.23x -> 1.70x); CGU16 ab-20260926T065423Z 0.755 (2.21x -> 1.68x); other 17 put/del rungs flat in both. Breadth CGU1 1-round flagged 5 get/scan rungs +5-8 %; disassembly identical (alignment moved only), 3-round confirm ab-20260926T083637Z flat 0.999-1.010."}
{"date": "2026-09-26T10:52:50+00:00", "rung": "put/val/v8", "hypothesis": "SipHash probes of RwTxn.open (HashMap<u32,_>) cost 7.5 % of put/val/v8 samples; LMDB reads txn->mt_dbs[dbi] by index; a dbi-indexed Vec does the same. Expected put/val/v8 >= 10 % faster.", "outcome": "kept", "commit": "4fc1c9e", "verdict": "improved", "base": "5cda1399b94acb5db01316f2512c6758cd2628e4", "host": "Linux x86_64", "rounds": 3, "rungs": [{"rung": "put/api/plain", "state": "improved", "ratio_vs_lmdb_before": 1.0502731605123237, "ratio_vs_lmdb_after": 0.9712068477738217, "speedup": 0.9248535898546498}, {"rung": "put/api/reserved", "state": "improved", "ratio_vs_lmdb_before": 1.1547751833731816, "ratio_vs_lmdb_after": 1.0355374737768293, "speedup": 0.8965569464709562}, {"rung": "put/order/append", "state": "improved", "ratio_vs_lmdb_before": 1.44862110494267, "ratio_vs_lmdb_after": 1.2961414651992618, "speedup": 0.8968449522884289}, {"rung": "put/order/rand", "state": "improved", "ratio_vs_lmdb_before": 1.1226982560117134, "ratio_vs_lmdb_after": 1.0744696019177897, "speedup": 0.9411350359242443}, {"rung": "put/order/seq", "state": "improved", "ratio_vs_lmdb_before": 1.0338712097415328, "ratio_vs_lmdb_after": 0.9649752005580136, "speedup": 0.935161131961362}, {"rung": "put/over/grow", "state": "improved", "ratio_vs_lmdb_before": 1.382427026734109, "ratio_vs_lmdb_after": 1.283774992716194, "speedup": 0.9298216787158083}, {"rung": "put/over/same_size", "state": "improved", "ratio_vs_lmdb_before": 1.224399481180419, "ratio_vs_lmdb_after": 1.1643962151058103, "speedup": 0.9499631417129094}, {"rung": "put/val/v256", "state": "improved", "ratio_vs_lmdb_before": 1.117599679714769, "ratio_vs_lmdb_after": 1.0242156866055592, "speedup": 0.9164423587406153}, {"rung": "put/val/v8", "state": "improved", "ratio_vs_lmdb_before": 1.2831866085959325, "ratio_vs_lmdb_after": 1.0963910579006106, "speedup": 0.8559022729489477}], "notes": "CGU1 verdict attached (put/val/v8 0.856, 9 improved/0 regressed); CGU16 ab-20260926T094215Z 0.852, 8/0. Breadth CGU1 1-round ab-20260926T103536Z: commit/batch n100/n10k, mixed, del/* faster; del/clear/all flag not confirmed over 3 rounds (ab-20260926T104507Z, 0.984)."}
{"date": "2026-09-26T13:00:52+00:00", "rung": "put/val/v8", "hypothesis": "The write-path descent's heap Vec path (malloc/free/grow ~3 % of put/val/v8) is avoidable; LMDB's mdb_put descends with a stack cursor (fixed CURSOR_STACK array); using btree::PathStack (inline, 32 frames) in search_path/rightmost_path does the same.", "outcome": "reverted", "verdict": "regressed", "base": "bb1b8eb5c8c0cf084ad69fb2d74a67ecbd7a1e75", "host": "Linux x86_64", "rounds": 3, "rungs": [{"rung": "del/cursor/drain", "state": "regressed", "ratio_vs_lmdb_before": 3.451841636142455, "ratio_vs_lmdb_after": 3.5803605603785704, "speedup": 1.037231987380435}, {"rung": "put/api/plain", "state": "regressed", "ratio_vs_lmdb_before": 0.975316862390162, "ratio_vs_lmdb_after": 1.0176348531536288, "speedup": 1.0370528324578396}, {"rung": "put/api/reserved", "state": "regressed", "ratio_vs_lmdb_before": 1.0788129339229073, "ratio_vs_lmdb_after": 1.1305546041904149, "speedup": 1.050273804336458}, {"rung": "put/order/seq", "state": "regressed", "ratio_vs_lmdb_before": 0.9537392333053456, "ratio_vs_lmdb_after": 0.9948609609430578, "speedup": 1.039283472668045}, {"rung": "put/val/v256", "state": "regressed", "ratio_vs_lmdb_before": 1.020469508561507, "ratio_vs_lmdb_after": 1.0701183763695732, "speedup": 1.0450585345181689}, {"rung": "put/val/v8", "state": "regressed", "ratio_vs_lmdb_before": 1.0817496646126656, "ratio_vs_lmdb_after": 1.1781462613082754, "speedup": 1.082542882977371}], "notes": "Regressed: CGU16 put/val/v8 1.083 and put/api/reserved, put/val/v256, put/order/seq, put/api/plain, del/cursor/drain +3.7-5 %; CGU1 (ab-20260926T122104Z) put/api/reserved 1.045, del/churn 1.037. Cost moved: PathStack is 520 B, zero-initialised per op and returned by value through search_path; the Vec held 2-3 frames. Retry idea: a per-txn reusable path buffer (taken/restored with mem::take, so no alloc and no 512 B init), or an out-parameter PathStack without zero-init. Patch saved: attempt-3c-pathstack-write-path.patch."}
{"date": "2026-09-26T15:11:47+00:00", "rung": "put/val/v8", "hypothesis": "A fresh descent-path Vec per put/delete (alloc+grow+free, ~3 % of put/val/v8) is avoidable; LMDB allocates its cursor stack once and reuses it; one per-txn path buffer (mem::take/restore) does the same without the 520 B init/copy that sank the inline-PathStack try.", "outcome": "kept", "commit": "2142ab2", "verdict": "improved", "base": "9eb19d43582482bac09aa2aab4cdf5f9d330e10f", "host": "Linux x86_64", "rounds": 3, "rungs": [{"rung": "put/api/plain", "state": "improved", "ratio_vs_lmdb_before": 0.9611598166248351, "ratio_vs_lmdb_after": 0.9218874423356671, "speedup": 0.9591406407031506}, {"rung": "put/order/seq", "state": "improved", "ratio_vs_lmdb_before": 0.9409307492722329, "ratio_vs_lmdb_after": 0.902315902043672, "speedup": 0.9577530726985748}, {"rung": "put/val/v256", "state": "improved", "ratio_vs_lmdb_before": 1.019132230096769, "ratio_vs_lmdb_after": 0.9614882952707303, "speedup": 0.9431711759645406}, {"rung": "put/val/v8", "state": "improved", "ratio_vs_lmdb_before": 1.1079013347217654, "ratio_vs_lmdb_after": 0.9630199198651597, "speedup": 0.869228955398821}], "notes": "Retry of the reverted inline PathStack (9eb19d4): different mechanism, no zero-init and no by-value copy. CGU1 put/val/v8 1.11x -> 0.96x (4 improved/0 regressed); CGU16 1.08x -> 1.00x (8/0). Breadth CGU1 ab-20260926T150625Z: commit/batch/n10k 0.961, nothing slower."}
