{"date": "2026-09-28T17:39:18+00:00", "rung": "^(put|commit|mixed|del)/", "hypothesis": "ADR-0015: rightmost-leaf finger (roadmap #6) as an opt-in env option with per-database override; the off path must stay free.", "outcome": "kept", "commit": "7f6a36b", "verdict": "regressed", "base": "7f6a36bbc82d2c5847aee3bfa2df4dcf039915a6", "host": "Linux x86_64", "rounds": 1, "rungs": [{"rung": "commit/batch/n1", "state": "regressed", "ratio_vs_lmdb_before": 1.949714803657393, "ratio_vs_lmdb_after": 2.087866897329486, "speedup": 1.070857590768116}, {"rung": "commit/batch/n100", "state": "improved", "ratio_vs_lmdb_before": 1.1387701123281704, "ratio_vs_lmdb_after": 1.0498283469155913, "speedup": 0.9218966458201637}, {"rung": "commit/batch/n10k", "state": "improved", "ratio_vs_lmdb_before": 0.9079339265726301, "ratio_vs_lmdb_after": 0.818945500578553, "speedup": 0.9019879934104892}, {"rung": "commit/sync/n1", "state": "unreliable", "ratio_vs_lmdb_before": 0.9265663134204191, "ratio_vs_lmdb_after": 0.9373334352302191, "speedup": 1.0116204546332503}, {"rung": "commit/sync/n100", "state": "unreliable", "ratio_vs_lmdb_before": 0.9870869677931882, "ratio_vs_lmdb_after": 0.9485836168044441, "speedup": 0.9609929497146283}, {"rung": "del/bulk/all", "state": "flat", "ratio_vs_lmdb_before": 1.6423146788835652, "ratio_vs_lmdb_after": 1.6656249543097876, "speedup": 1.0141935499487034}, {"rung": "del/bulk/half", "state": "flat", "ratio_vs_lmdb_before": 1.625789045614225, "ratio_vs_lmdb_after": 1.655191963955535, "speedup": 1.0180853219675876}, {"rung": "del/churn/reinsert", "state": "regressed", "ratio_vs_lmdb_before": 1.3337204744128222, "ratio_vs_lmdb_after": 1.425316171524839, "speedup": 1.0686768321168214}, {"rung": "del/clear/all", "state": "flat", "ratio_vs_lmdb_before": 1.8196319239795324, "ratio_vs_lmdb_after": 1.790783732912902, "speedup": 0.9841461392897858}, {"rung": "del/cursor/drain", "state": "flat", "ratio_vs_lmdb_before": 2.735279698539539, "ratio_vs_lmdb_after": 2.7851668336117927, "speedup": 1.0182384035895453}, {"rung": "del/range/half", "state": "flat", "ratio_vs_lmdb_before": 0.9301240798933698, "ratio_vs_lmdb_after": 0.9072057681642729, "speedup": 0.975359941512616}, {"rung": "mixed/rw/8dbs", "state": "regressed", "ratio_vs_lmdb_before": 0.9035017870095878, "ratio_vs_lmdb_after": 0.9661019092541843, "speedup": 1.0692861078358133}, {"rung": "put/api/plain", "state": "improved", "ratio_vs_lmdb_before": 0.8651844972278332, "ratio_vs_lmdb_after": 0.7909611670885581, "speedup": 0.9142109799966406}, {"rung": "put/api/reserved", "state": "improved", "ratio_vs_lmdb_before": 0.9336191367776259, "ratio_vs_lmdb_after": 0.8264936229384029, "speedup": 0.885257799867979}, {"rung": "put/gc/drain_big", "state": "flat", "ratio_vs_lmdb_before": 1.1575971217831353, "ratio_vs_lmdb_after": 1.183785173745973, "speedup": 1.0226227687250107}, {"rung": "put/order/append", "state": "flat", "ratio_vs_lmdb_before": 1.1293444626977043, "ratio_vs_lmdb_after": 1.1325436535224025, "speedup": 1.0028327856826396}, {"rung": "put/order/rand", "state": "regressed", "ratio_vs_lmdb_before": 0.9485849013128349, "ratio_vs_lmdb_after": 1.0032155977262511, "speedup": 1.0575917836535325}, {"rung": "put/order/seq", "state": "improved", "ratio_vs_lmdb_before": 0.8669388015930952, "ratio_vs_lmdb_after": 0.7937468878586305, "speedup": 0.9155743016693144}, {"rung": "put/over/grow", "state": "flat", "ratio_vs_lmdb_before": 1.2236959886187369, "ratio_vs_lmdb_after": 1.246083269290489, "speedup": 1.0182948059648558}, {"rung": "put/over/same_size", "state": "flat", "ratio_vs_lmdb_before": 1.0197616598619845, "ratio_vs_lmdb_after": 1.0431145606604546, "speedup": 1.022900351834791}, {"rung": "put/val/v256", "state": "improved", "ratio_vs_lmdb_before": 0.8871454657883332, "ratio_vs_lmdb_after": 0.8269436048175821, "speedup": 0.9321398087547519}, {"rung": "put/val/v2page", "state": "flat", "ratio_vs_lmdb_before": 1.0183471297306872, "ratio_vs_lmdb_after": 1.0120692560781286, "speedup": 0.993835232143072}, {"rung": "put/val/v4k", "state": "flat", "ratio_vs_lmdb_before": 1.0040327256609185, "ratio_vs_lmdb_after": 0.9971078176755975, "speedup": 0.9931029061022264}, {"rung": "put/val/v8", "state": "improved", "ratio_vs_lmdb_before": 0.8681725786501612, "ratio_vs_lmdb_after": 0.7307278017648888, "speedup": 0.8416849595745444}], "notes": "Off vs pre-option commit: flat 22/22 CGU1 x3, flat 8/8 flagged CGU16 x3 (a first layout cost rand +3.3 %, n1 +5.6 %, clear +6.3 %). On vs off CGU1 x1: v8 0.87x -> 0.73x, seq/plain 0.87x -> 0.79x, reserved 0.93x -> 0.83x, n10k 0.91x -> 0.82x; rand +5.8 %, mixed +6.9 %, churn +6.9 %, n1 +7.1 %. Use per database for grow-only keys."}
{"date": "2026-09-28T21:27:34+00:00", "rung": "scan/full/fwd", "hypothesis": "LeafRef::new's per-cell walk is 22 % of scan/full/fwd (each leaf validated once per txn in a scan). A branch-free pass (OR-ed verdicts, clamped in-bounds reads, exact loop only on rejection) would cut it.", "outcome": "reverted", "verdict": "regressed", "base": "5275c9d3c98e08f745f309258f28a78deceaae03", "host": "Linux x86_64", "rounds": 1, "rungs": [{"rung": "scan/full/fwd", "state": "regressed", "ratio_vs_lmdb_before": 1.7008613497211396, "ratio_vs_lmdb_after": 1.7879366271646344, "speedup": 1.05119481223897}], "notes": "Screen CGU1 1 round: 1.70x -> 1.79x (+5.1 %). On valid pages the exact loop's early-exit branches are perfectly predicted; the branch-free pass does more work per cell. Equivalence proptest was green. Remaining default-path option is lazy (read-time) validation = ADR. Patch: research/next-b25-branchfree-leaf-validate.patch."}
{"date": "2026-09-28T21:32:38+00:00", "rung": "scan/full/fwd", "hypothesis": "Cursor::next/prev re-derive state, frame and leaf view through current() after stepping; read the entry directly from the view in hand, as mdb_cursor_next does.", "outcome": "reverted", "verdict": "flat", "base": "849012570a3bf46a399205b0367f092f5d5c3ead", "host": "Linux x86_64", "rounds": 1, "rungs": [{"rung": "scan/full/fwd", "state": "flat", "ratio_vs_lmdb_before": 1.695162480587785, "ratio_vs_lmdb_after": 1.688262304682215, "speedup": 0.9959294899547462}], "notes": "Screen CGU1 1 round: 1.70x -> 1.69x (0.996, flat). The redundant checks were already optimized away. Trusted-mode scan profile: Cursor::current 24 % (half on the first-touch cell header load, which LMDB pays too), RoRange::next 10.5 %, Cursor::next 8 %, descend_min 5 %. Patch: research/next-cursor-direct-step.patch."}
{"date": "2026-09-28T21:40:40+00:00", "rung": "get/val/(v4k|v2page)", "hypothesis": "resolve_value is 16.6 % of get/val/v4k: OverflowRef::new re-validates the page size and length-checks twice; a one-pass resolver keeping every corruption check would cut it.", "outcome": "reverted", "verdict": "flat", "base": "2162d26feedf7ef483dafe023b619b5a5e836ed2", "host": "Linux x86_64", "rounds": 1, "rungs": [{"rung": "get/val/v4k", "state": "flat", "ratio_vs_lmdb_before": 1.3267252901298703, "ratio_vs_lmdb_after": 1.3256123745640611, "speedup": 0.9991611559875367}, {"rung": "get/val/v4k_touch", "state": "flat", "ratio_vs_lmdb_before": 1.165002314001617, "ratio_vs_lmdb_after": 1.1671730239792413, "speedup": 1.0018632666661134}], "notes": "Screen CGU1 1 round: all four rungs flat (0.996-1.003). The cost is the cache miss on the overflow page header, which LMDB never reads (mdb_node_read computes METADATA(omp) from the pgno). Removing that read is a validation-policy change (default: corrupt run -> no error; trusted: amend ADR-0014), not a code-shape lever. Equivalence proptest green. Patch: research/next-b26-overflow-resolve.patch. Third consecutive revert: loop stopped."}
{"date": "2026-09-29T07:12:43+00:00", "rung": "env/stat/non_free", "hypothesis": "Compute non_free_pages_size as heed does (sum of per-DB branch+leaf+overflow pages x psize from the catalog records) instead of file length minus a free-list walk.", "outcome": "kept", "commit": "c82e5c8", "verdict": "improved", "base": "2b18e13459d608d1b7f9f42b2fe0b1fa5cc24b48", "host": "Linux x86_64", "rounds": 3, "rungs": [{"rung": "env/stat/non_free", "state": "improved", "ratio_vs_lmdb_before": 467.36709983463703, "ratio_vs_lmdb_after": 0.4090627433191953, "speedup": 0.000876377399962867}], "notes": "CGU1 3 rounds: 169 us -> 148 ns (467x -> 0.41x LMDB). Also fixes WRITE_MAP (file = whole map). SPEC GC-23/24 + INV-27 amended with maintainer approval 2026-09-29."}
{"date": "2026-09-29T09:24:02+00:00", "rung": "get/val/(v4k|v2page)", "hypothesis": "Under the trusting policy, skip the overflow run header read (a cache miss LMDB never takes); the slice stays bounded by the high-water.", "outcome": "kept", "commit": "3433c1c", "verdict": "improved", "base": "e3fac68c5230e9cc558ec742b79182d44021f9cc", "host": "Linux x86_64", "rounds": 3, "rungs": [{"rung": "get/val/v2page", "state": "improved", "ratio_vs_lmdb_before": 1.2683163931666372, "ratio_vs_lmdb_after": 0.8939803334908039, "speedup": 0.7053072606628479}, {"rung": "get/val/v2page_touch", "state": "improved", "ratio_vs_lmdb_before": 1.1340858591497602, "ratio_vs_lmdb_after": 0.9281012597742213, "speedup": 0.8186648538608421}, {"rung": "get/val/v4k", "state": "improved", "ratio_vs_lmdb_before": 1.285521865690858, "ratio_vs_lmdb_after": 0.910601135289626, "speedup": 0.7058682041087869}, {"rung": "get/val/v4k_touch", "state": "improved", "ratio_vs_lmdb_before": 1.1432224986941995, "ratio_vs_lmdb_after": 0.9362966753972075, "speedup": 0.8189977685591872}], "notes": "Both sides trusted, CGU1 3 rounds: v4k 1.29x -> 0.91x, v2page 1.27x -> 0.89x, v4k_touch 1.14x -> 0.94x, v2page_touch 1.13x -> 0.93x; default mode 9/9 flat. ADR-0014 amended (approved 2026-09-29)."}
{"date": "2026-09-29T10:57:20+00:00", "rung": "^get/(access|db|key|size)/", "hypothesis": "ADR-0016 step 1: lazy (read-time) cell validation for read-txn point lookups, promoting a leaf to full validation after repeated views.", "outcome": "abandoned", "verdict": "regressed", "base": "e6995c63d3f6c872964c5196c6fbb5fa19e5f4cf", "host": "Linux x86_64", "rounds": 3, "rungs": [{"rung": "get/access/hot", "state": "improved", "ratio_vs_lmdb_before": 0.7723833477580888, "ratio_vs_lmdb_after": 0.7171304399555068, "speedup": 0.9289952810848141}, {"rung": "get/access/miss", "state": "regressed", "ratio_vs_lmdb_before": 0.9844666233035854, "ratio_vs_lmdb_after": 1.0974215418119944, "speedup": 1.112302622461572}, {"rung": "get/access/rand", "state": "improved", "ratio_vs_lmdb_before": 1.1452838561880703, "ratio_vs_lmdb_after": 1.1038394424602331, "speedup": 0.9623373421758004}, {"rung": "get/access/seq", "state": "regressed", "ratio_vs_lmdb_before": 0.9368668408318617, "ratio_vs_lmdb_after": 1.1337536984513943, "speedup": 1.2101545801799467}, {"rung": "get/db/named", "state": "flat", "ratio_vs_lmdb_before": 1.1499486783719348, "ratio_vs_lmdb_after": 1.1050392187717908, "speedup": 0.9581945138965637}, {"rung": "get/db/named_x8", "state": "flat", "ratio_vs_lmdb_before": 1.2192745410779966, "ratio_vs_lmdb_after": 1.137789517457877, "speedup": 0.9277893501448393}, {"rung": "get/db/root", "state": "improved", "ratio_vs_lmdb_before": 1.140142607922785, "ratio_vs_lmdb_after": 1.088793448253135, "speedup": 0.954962511432493}, {"rung": "get/key/k128", "state": "improved", "ratio_vs_lmdb_before": 1.274988775979912, "ratio_vs_lmdb_after": 1.1959490983358871, "speedup": 0.93800755023645}, {"rung": "get/key/k32", "state": "improved", "ratio_vs_lmdb_before": 1.3391023989938706, "ratio_vs_lmdb_after": 1.2494892566896996, "speedup": 0.9349851552607301}, {"rung": "get/key/k8", "state": "flat", "ratio_vs_lmdb_before": 1.1496236181064756, "ratio_vs_lmdb_after": 1.0934211003705563, "speedup": 0.952795223857582}, {"rung": "get/size/n1k", "state": "improved", "ratio_vs_lmdb_before": 0.9311541385250653, "ratio_vs_lmdb_after": 0.9040335799065821, "speedup": 0.9696235711892488}, {"rung": "get/size/n1m", "state": "improved", "ratio_vs_lmdb_before": 1.4712196723126478, "ratio_vs_lmdb_after": 1.1369434429010923, "speedup": 0.7728976064358735}, {"rung": "get/size/n50k", "state": "improved", "ratio_vs_lmdb_before": 1.1527721784551253, "ratio_vs_lmdb_after": 1.0929704855778282, "speedup": 0.9472967716427192}], "notes": "4 variants (promote on 2nd view / never / after 8 / after 8 out of line). Best: n1m 1.47x -> 1.14x, random -4..7 %, but miss +11..17 % and seq +21..23 %. Lazy lookups cost several times a zero-check one; restructuring find_exact alone (lazy disabled) cost miss +17 %, rand +6 % (B13 inlining threshold). Parked; patch research/next-adr16-lazy-point-lookups.patch; resume ideas in ADR-0016 Results."}
