{"date": "2026-09-27T14:20:43+00:00", "rung": "get/key/k8", "hypothesis": "Equal-length 8/4-byte keys compare as one BE integer instead of memcmp (roadmap #7 e).", "outcome": "kept", "commit": "ef61096", "verdict": "regressed", "base": "b7fa519282c7089ba3fcfcb99b86a78f9a9c803e", "host": "Linux x86_64", "rounds": 3, "rungs": [{"rung": "get/access/hot", "state": "improved", "ratio_vs_lmdb_before": 0.9251517417568982, "ratio_vs_lmdb_after": 0.769765587398416, "speedup": 0.8320425208697139}, {"rung": "get/access/miss", "state": "improved", "ratio_vs_lmdb_before": 1.1257098674531842, "ratio_vs_lmdb_after": 0.9576434985890463, "speedup": 0.8524344286159138}, {"rung": "get/access/seq", "state": "improved", "ratio_vs_lmdb_before": 1.0309421061333368, "ratio_vs_lmdb_after": 0.9094195475689806, "speedup": 0.8821247499336892}, {"rung": "get/db/named", "state": "improved", "ratio_vs_lmdb_before": 1.238942829980729, "ratio_vs_lmdb_after": 1.1742347600286018, "speedup": 0.9506137135928336}, {"rung": "get/key/k128", "state": "regressed", "ratio_vs_lmdb_before": 1.2037942892656355, "ratio_vs_lmdb_after": 1.263414337601617, "speedup": 1.0512551456866683}, {"rung": "get/key/k8", "state": "improved", "ratio_vs_lmdb_before": 1.2427953110538523, "ratio_vs_lmdb_after": 1.1432659295030583, "speedup": 0.9199149041957712}, {"rung": "get/size/n1k", "state": "improved", "ratio_vs_lmdb_before": 0.9978609862047076, "ratio_vs_lmdb_after": 0.9245385854804485, "speedup": 0.9253765497727009}, {"rung": "get/size/n50k", "state": "improved", "ratio_vs_lmdb_before": 1.2323498680722156, "ratio_vs_lmdb_after": 1.125913711189278, "speedup": 0.9136315427619291}, {"rung": "get/val/v256", "state": "improved", "ratio_vs_lmdb_before": 1.0433074572810606, "ratio_vs_lmdb_after": 0.9577592073314293, "speedup": 0.9222718767171894}, {"rung": "get/val/v2page", "state": "improved", "ratio_vs_lmdb_before": 1.3708164112156755, "ratio_vs_lmdb_after": 1.266420344935353, "speedup": 0.9232060361217096}, {"rung": "get/val/v2page_touch", "state": "improved", "ratio_vs_lmdb_before": 1.2194237608722418, "ratio_vs_lmdb_after": 1.147133996516271, "speedup": 0.9412922135974325}, {"rung": "get/val/v4k", "state": "improved", "ratio_vs_lmdb_before": 1.4172733158086472, "ratio_vs_lmdb_after": 1.307801278052154, "speedup": 0.9265055449509412}, {"rung": "get/val/v4k_touch", "state": "improved", "ratio_vs_lmdb_before": 1.2404124245822516, "ratio_vs_lmdb_after": 1.160210455737107, "speedup": 0.9353779248208353}, {"rung": "get/val/v8", "state": "improved", "ratio_vs_lmdb_before": 1.0152170610998406, "ratio_vs_lmdb_after": 0.9136077168510254, "speedup": 0.8999136754668642}, {"rung": "get/val/v8_touch", "state": "improved", "ratio_vs_lmdb_before": 1.016140345698783, "ratio_vs_lmdb_after": 0.909524956324882, "speedup": 0.8987606379884996}, {"rung": "put/api/plain", "state": "improved", "ratio_vs_lmdb_before": 0.9185440320581495, "ratio_vs_lmdb_after": 0.865016786895666, "speedup": 0.9428369581697988}, {"rung": "put/api/reserved", "state": "improved", "ratio_vs_lmdb_before": 0.9659481186723127, "ratio_vs_lmdb_after": 0.9344551414110763, "speedup": 0.9678287374324044}, {"rung": "put/order/rand", "state": "improved", "ratio_vs_lmdb_before": 1.0281543384105338, "ratio_vs_lmdb_after": 0.9860027514144284, "speedup": 0.964126812805615}, {"rung": "put/order/seq", "state": "improved", "ratio_vs_lmdb_before": 0.91913753734747, "ratio_vs_lmdb_after": 0.8640857633274119, "speedup": 0.9401049660326882}, {"rung": "seek/ge/rand", "state": "improved", "ratio_vs_lmdb_before": 1.1912470752377926, "ratio_vs_lmdb_after": 1.1089899337118942, "speedup": 0.9310756455426273}, {"rung": "seek/ge/seq", "state": "improved", "ratio_vs_lmdb_before": 1.291618848796388, "ratio_vs_lmdb_after": 1.2099692253825685, "speedup": 0.9367850480891435}], "notes": "Maintainer override (Quentin, 2026-09-27: 'Yes keep it') of the 3756615 revert. CGU1 20 improved / get/key/k128 +5.1 %; CGU16 1 round 25 improved / k128 +4.4 %. Gate: local fmt/clippy/test/miri/fuzz green."}
{"date": "2026-09-27T15:13:44+00:00", "rung": "env/stat/non_free", "hypothesis": "free_page_count decodes and validates every PIL id only to count them; heed/LMDB never read the freelist; reading only each PIL's count prefix removes the per-entry Vec and id walk (roadmap #10). Expected ~2-7x on fragmented envs.", "outcome": "kept", "commit": "f98374a", "verdict": "invalid", "base": "5f38f1e1ef8d19bb7a22ac405d3854282d7716b7", "host": "Linux x86_64", "rounds": 3, "rungs": [{"rung": "env/stat/non_free", "state": "unreliable", "ratio_vs_lmdb_before": 893.231150639803, "ratio_vs_lmdb_after": 478.69111614864056, "speedup": 0.5365695535488678}], "notes": "CGU1 3 rounds 0.537 (verdict invalid from LMDB drift 0.895 on a 0.35 us op); CGU16 1 round 0.524; screen 0.537. Other env rungs flat. Gate: local fmt/clippy/test/miri/fuzz green. Follow-up: heed-formula O(#DBs) count needs SPEC GC-23/24 amendment (still ~480x LMDB)."}
{"date": "2026-09-27T16:10:48+00:00", "rung": "del/clear/all", "hypothesis": "clear loads every leaf only to collect pgnos; LMDB's mdb_drop0 frees leaf pgnos from the lowest branch level when there are no overflow pages; doing the same (with a bound check on every unread pgno) removes the leaf reads (roadmap #5a).", "outcome": "kept", "commit": "c60a31e", "verdict": "regressed", "base": "b063ea871957b0aa30f59ce4fd2ba224300286f9", "host": "Linux x86_64", "rounds": 3, "rungs": [{"rung": "del/bulk/half", "state": "regressed", "ratio_vs_lmdb_before": 1.6511835916583493, "ratio_vs_lmdb_after": 1.7603737226690428, "speedup": 1.0658832373807452}, {"rung": "del/clear/all", "state": "improved", "ratio_vs_lmdb_before": 12.729533578102405, "ratio_vs_lmdb_after": 1.782003740737402, "speedup": 0.14063692485834822}], "notes": "CGU1 0.141 (12.73x -> 1.78x), CGU16 1 round 0.155. del/bulk, range/half, churn +4-7 % in both builds, discounted: all 10 per-key delete-path functions byte-identical in both CGU16 binaries, only clear_tree/collect_tree differ (layout, PERF-GAP B13 pt 4). Gate: local fmt/clippy/test/miri/fuzz + server crash/stress green."}
{"date": "2026-09-27T19:24:35+00:00", "rung": "del/cursor/drain", "hypothesis": "del_current discards its path on every borrow/merge (~86 % of drain deletes), so the next step re-descends (~270 ns); LMDB's mdb_cursor_del0 repairs the cursor after mdb_rebalance; repairing the leftmost-pairing cases does the same (roadmap #5b).", "outcome": "kept", "commit": "17fdb24", "verdict": "improved", "base": "314d47cb408e096bf2e5e0670c3b604483f98c0a", "host": "Linux x86_64", "rounds": 3, "rungs": [{"rung": "del/cursor/drain", "state": "improved", "ratio_vs_lmdb_before": 2.910751058417575, "ratio_vs_lmdb_after": 2.6327356054405384, "speedup": 0.8891060674883158}], "notes": "Screen 0.878; CGU1 first run 0.893 (invalid: drift; bulk/half +5.1 %, range/half +3.5 %); CGU1 re-run (verdict attached) 0.889 improved, all other del rungs flat; CGU16 1 round 0.914. Gate: local fmt/clippy/test/miri/fuzz + server crash/stress green. From-left rules not implemented (next step if wanted)."}
{"date": "2026-09-27T21:37:45+00:00", "rung": "del/range/half", "hypothesis": "delete_range materializes every covered key and point-deletes each (a descent + rebalance per key); a single leaf-granular walk that splices covered cells per leaf and rebalances once per leaf removes both (roadmap #5c). Beyond LMDB, which has no bulk range delete.", "outcome": "kept", "commit": "3512269", "verdict": "improved", "base": "9d8bc4d2f84f942a913ebdf278d1dba473ec20af", "host": "Linux x86_64", "rounds": 3, "rungs": [{"rung": "del/range/half", "state": "improved", "ratio_vs_lmdb_before": 2.634227535944877, "ratio_vs_lmdb_after": 0.923897333915295, "speedup": 0.3511138255350056}], "notes": "Screen 0.362; CGU1 3 rounds 0.351 (2.63x -> 0.92x), CGU16 1 round 0.375; 17 other put/del rungs flat both builds. Gate: local fmt/clippy/test/miri/fuzz + server crash/stress green."}
{"date": "2026-09-27T23:55:26+00:00", "rung": "put/order/append", "hypothesis": "Sequential/APPEND puts re-descend to the rightmost leaf on every put; a per-tree rightmost-leaf finger (PostgreSQL nbtree fastpath; LMDB has none) inserts there directly, re-verifying the spine on each hit (roadmap #6).", "outcome": "reverted", "verdict": "regressed", "base": "ddd5d68526e51e7fe829f27d4000b6846b769c81", "host": "Linux x86_64", "rounds": 3, "rungs": [{"rung": "commit/batch/n10k", "state": "improved", "ratio_vs_lmdb_before": 0.8950743400311879, "ratio_vs_lmdb_after": 0.7742475602488923, "speedup": 0.8692155765373268}, {"rung": "mixed/rw/8dbs", "state": "regressed", "ratio_vs_lmdb_before": 0.9163090731279603, "ratio_vs_lmdb_after": 0.9462398497666611, "speedup": 1.0326644988208264}, {"rung": "put/api/plain", "state": "improved", "ratio_vs_lmdb_before": 0.8625273444061858, "ratio_vs_lmdb_after": 0.7495609163126596, "speedup": 0.8690285834690854}, {"rung": "put/api/reserved", "state": "improved", "ratio_vs_lmdb_before": 0.9350595160857346, "ratio_vs_lmdb_after": 0.8051952590534759, "speedup": 0.8600751498824636}, {"rung": "put/order/append", "state": "improved", "ratio_vs_lmdb_before": 1.106844943377397, "ratio_vs_lmdb_after": 1.0668254401404578, "speedup": 0.9639368654450841}, {"rung": "put/order/rand", "state": "regressed", "ratio_vs_lmdb_before": 0.9411148653147553, "ratio_vs_lmdb_after": 0.9897817839695853, "speedup": 1.0475967466180083}, {"rung": "put/order/seq", "state": "improved", "ratio_vs_lmdb_before": 0.8659514616919753, "ratio_vs_lmdb_after": 0.7476796404380505, "speedup": 0.8634198029727502}, {"rung": "put/val/v8", "state": "improved", "ratio_vs_lmdb_before": 0.8238142924273347, "ratio_vs_lmdb_after": 0.6243425884502881, "speedup": 0.7629137188575523}], "notes": "Gate green (local + server crash/stress). Big wins both builds: put/val/v8 0.82x -> 0.62x, put/order/seq 0.87x -> 0.75x, put/api/reserved 0.94x -> 0.81x, commit/batch/n10k 0.90x -> 0.77x. But confirmed 3-round regressions: put/order/rand +4.8 % (CGU1) / +3.3 %, mixed/rw/8dbs +3.3 % / +4.1 % (the milli-shaped rung). Reordering the hit test (key compare before the spine walk) did not help, so the cost is the per-insert establish/forget bookkeeping, not the miss path. Reverted per rule; NEEDS QUENTIN'S CALL or a profile of the miss overhead. Patch (with reorder): research/next-6-rightmost-finger.patch."}
{"date": "2026-09-28T00:38:02+00:00", "rung": "put/gc/steady", "hypothesis": "Every n==1 GC draw rebuilds a Tree and re-walks the free DB from cursor.first() although the last-used entry still has ids, and passed-over PILs are re-decoded per request; LMDB resumes from me_pglast and merges each record once; a last-hit fast path + remembered PILs does the same (roadmap #1b).", "outcome": "reverted", "verdict": "flat", "base": "c7c8b24947826312b6bf452a602b53bbb11e7409", "host": "Linux x86_64", "rounds": 1, "rungs": [{"rung": "put/gc/steady", "state": "flat", "ratio_vs_lmdb_before": 1.1766419172313225, "ratio_vs_lmdb_after": 1.1500598429939772, "speedup": 0.9774085268865027}], "notes": "Screen (1 round, CGU1): put/gc/steady 0.977 (1.18x -> 1.15x), put/gc/drain_big 0.983 - flat, under the 0.97 bar. The scan cost it removes is already small after the O(1) front draw (37b03c9) and the frame pool (10c98a1): drain_big is 1.15x LMDB now (was 2.21x). Patch kept (byte-identity proof, debug shadow, forced-slow differential; note it added a debug-only #[doc(hidden)] pub test seam RwTxn::gc_force_slow_for_tests that would need sanctioning): research/next-1b-gc-last-hit.patch."}
{"date": "2026-09-28T12:14:58+00:00", "rung": "maint/copy/(raw|compact)", "hypothesis": "Env copies wrote each byte 2-3x (heed copy_to_file staged + io::copy; raw built a zeroed in-memory image; compact did one pwrite per page). LMDB mdb_env_copyfd2 writes into the fd directly, raw from the map, compact through a 1 MiB buffer.", "outcome": "kept", "commit": "2f479d2", "verdict": "improved", "base": "5ec996d1a706b3544000392704606105b0113b31", "host": "Linux x86_64", "rounds": 3, "rungs": [{"rung": "maint/copy/compact", "state": "improved", "ratio_vs_lmdb_before": 3.3063362326010832, "ratio_vs_lmdb_after": 1.5129546915807568, "speedup": 0.4555859714014634}, {"rung": "maint/copy/raw", "state": "improved", "ratio_vs_lmdb_before": 2.5264922962904257, "ratio_vs_lmdb_after": 0.9339153054445076, "speedup": 0.36964898203558666}], "notes": "CGU1 3 rounds: raw 2.53x -> 0.93x (0.370), compact 3.31x -> 1.51x (0.456). CGU16 1 round: raw -> 0.95x, compact -> 1.51x. An earlier run read flat because the server reused a stale binary (tar kept local mtimes across two worktrees); fixed in sync.sh with tar -m. Left: compact re-packs entries, LMDB copies pages."}
{"date": "2026-09-28T12:14:58+00:00", "rung": "^(get|seek|scan)/|commit/batch/n1", "hypothesis": "ADR-0014 opt-in trusted-file policy: an env opened with FileTrust::trust_contents skips the per-cell walk on first view of each map page (header checks kept), as LMDB reads pages.", "outcome": "kept", "commit": "5ec996d", "verdict": "improved", "base": "5ec996d1a706b3544000392704606105b0113b31", "host": "Linux x86_64", "rounds": 1, "rungs": [{"rung": "commit/batch/n1", "state": "flat", "ratio_vs_lmdb_before": 1.8791367934837726, "ratio_vs_lmdb_after": 1.8358859509758898, "speedup": 0.9769836647029304}, {"rung": "commit/batch/n100", "state": "flat", "ratio_vs_lmdb_before": 1.0625924932639776, "ratio_vs_lmdb_after": 1.0616786771093611, "speedup": 0.9991400126008707}, {"rung": "commit/batch/n10k", "state": "flat", "ratio_vs_lmdb_before": 0.8912019078903095, "ratio_vs_lmdb_after": 0.8858063227276216, "speedup": 0.9939457208126264}, {"rung": "get/access/hot", "state": "flat", "ratio_vs_lmdb_before": 0.7806529055851174, "ratio_vs_lmdb_after": 0.7771977099848107, "speedup": 0.9955739668992625}, {"rung": "get/access/miss", "state": "flat", "ratio_vs_lmdb_before": 0.9646765628244109, "ratio_vs_lmdb_after": 0.962352042892338, "speedup": 0.9975903634216352}, {"rung": "get/access/rand", "state": "improved", "ratio_vs_lmdb_before": 1.1468627624359131, "ratio_vs_lmdb_after": 0.9145228348034812, "speedup": 0.7974126153168085}, {"rung": "get/access/seq", "state": "improved", "ratio_vs_lmdb_before": 0.9034622699943067, "ratio_vs_lmdb_after": 0.8718729695664016, "speedup": 0.9650352853937064}, {"rung": "get/db/named", "state": "improved", "ratio_vs_lmdb_before": 1.1501980943364047, "ratio_vs_lmdb_after": 0.9151958408844186, "speedup": 0.7956854087925017}, {"rung": "get/db/named_x8", "state": "improved", "ratio_vs_lmdb_before": 1.2089782856193747, "ratio_vs_lmdb_after": 0.9566916262956414, "speedup": 0.7913224229709935}, {"rung": "get/db/root", "state": "improved", "ratio_vs_lmdb_before": 1.1406044976127487, "ratio_vs_lmdb_after": 0.9116983454258468, "speedup": 0.7993115469332309}, {"rung": "get/key/k128", "state": "improved", "ratio_vs_lmdb_before": 1.2490286085702658, "ratio_vs_lmdb_after": 1.104594495765583, "speedup": 0.8843628466044401}, {"rung": "get/key/k32", "state": "improved", "ratio_vs_lmdb_before": 1.32476551742741, "ratio_vs_lmdb_after": 1.1056972946750732, "speedup": 0.8346362281698348}, {"rung": "get/key/k8", "state": "improved", "ratio_vs_lmdb_before": 1.143120126368419, "ratio_vs_lmdb_after": 0.9192458237848159, "speedup": 0.8041550512326033}, {"rung": "get/size/n1k", "state": "flat", "ratio_vs_lmdb_before": 0.9121007795648134, "ratio_vs_lmdb_after": 0.9040997964463361, "speedup": 0.99122796153919}, {"rung": "get/size/n50k", "state": "improved", "ratio_vs_lmdb_before": 1.1419472944467552, "ratio_vs_lmdb_after": 0.91908293931909, "speedup": 0.8048383176601531}, {"rung": "get/val/v256", "state": "improved", "ratio_vs_lmdb_before": 0.9534563844772596, "ratio_vs_lmdb_after": 0.9123591387100906, "speedup": 0.9568965645033665}, {"rung": "get/val/v2page", "state": "flat", "ratio_vs_lmdb_before": 1.2782006361108151, "ratio_vs_lmdb_after": 1.2398681660330648, "speedup": 0.9700106000616737}, {"rung": "get/val/v2page_touch", "state": "flat", "ratio_vs_lmdb_before": 1.1598472182090553, "ratio_vs_lmdb_after": 1.1304886702174353, "speedup": 0.9746875730434967}, {"rung": "get/val/v4k", "state": "flat", "ratio_vs_lmdb_before": 1.3020423344712937, "ratio_vs_lmdb_after": 1.2644541200692578, "speedup": 0.9711313423481743}, {"rung": "get/val/v4k_touch", "state": "flat", "ratio_vs_lmdb_before": 1.1606743853439758, "ratio_vs_lmdb_after": 1.1384089871850391, "speedup": 0.9808168436901121}, {"rung": "get/val/v8", "state": "improved", "ratio_vs_lmdb_before": 0.9121992421524072, "ratio_vs_lmdb_after": 0.873451849662502, "speedup": 0.9575231038358707}, {"rung": "get/val/v8_touch", "state": "improved", "ratio_vs_lmdb_before": 0.91653505494694, "ratio_vs_lmdb_after": 0.8842482455561821, "speedup": 0.964772968348028}, {"rung": "mixed/rw/8dbs", "state": "flat", "ratio_vs_lmdb_before": 0.9084046258268622, "ratio_vs_lmdb_after": 0.9067544235276253, "speedup": 0.9981834061030513}, {"rung": "put/order/rand", "state": "flat", "ratio_vs_lmdb_before": 0.962340800913178, "ratio_vs_lmdb_after": 0.9627513047633132, "speedup": 1.0004265680616946}, {"rung": "put/val/v8", "state": "flat", "ratio_vs_lmdb_before": 0.8214226524159807, "ratio_vs_lmdb_after": 0.8214155743072538, "speedup": 0.9999913831098934}, {"rung": "scan/edge/first_last", "state": "flat", "ratio_vs_lmdb_before": 1.5106856561800937, "ratio_vs_lmdb_after": 1.5168867654884843, "speedup": 1.0041048309971188}, {"rung": "scan/full/fwd", "state": "unreliable", "ratio_vs_lmdb_before": 1.7172833655234037, "ratio_vs_lmdb_after": 1.446776293216088, "speedup": 0.8424796526082526}, {"rung": "scan/full/rev", "state": "unreliable", "ratio_vs_lmdb_before": 1.617800373550619, "ratio_vs_lmdb_after": 1.4309298935495096, "speedup": 0.884491014431539}, {"rung": "scan/meta/len", "state": "flat", "ratio_vs_lmdb_before": 1.1499998038161174, "ratio_vs_lmdb_after": 1.1499715629566591, "speedup": 0.9999754427267165}, {"rung": "scan/prefix/bucket", "state": "improved", "ratio_vs_lmdb_before": 2.3297303590004663, "ratio_vs_lmdb_after": 1.7398050289528102, "speedup": 0.7467838594416762}, {"rung": "scan/range/10pct", "state": "improved", "ratio_vs_lmdb_before": 1.7299170538003474, "ratio_vs_lmdb_after": 1.3284721652809874, "speedup": 0.7679398051846181}, {"rung": "scan/range/1pct", "state": "improved", "ratio_vs_lmdb_before": 1.8089150027076328, "ratio_vs_lmdb_after": 1.3804394091347734, "speedup": 0.7631311626408617}, {"rung": "seek/ge/gap", "state": "improved", "ratio_vs_lmdb_before": 1.3056125268658691, "ratio_vs_lmdb_after": 1.0999057467975912, "speedup": 0.8424442353030432}, {"rung": "seek/ge/rand", "state": "improved", "ratio_vs_lmdb_before": 1.1149867732329681, "ratio_vs_lmdb_after": 0.9081510181580498, "speedup": 0.8144948800825805}, {"rung": "seek/ge/seq", "state": "improved", "ratio_vs_lmdb_before": 1.151692545845594, "ratio_vs_lmdb_after": 0.8930920646928611, "speedup": 0.7754604889251379}], "notes": "Trusted vs validating, same binary (CAND_ENV), CGU1 1 round: random gets 1.14-1.21x -> 0.91-0.96x, seeks 1.11-1.31x -> 0.89-1.10x, range scans 1.73-1.81x -> 1.33-1.38x, prefix 2.33x -> 1.74x, no regression; CGU16 1 round 21 improved, 0 regressed. Default (validating) path vs 77188d8: v1 (flag before the memo probe) cost get/access/hot +3.3 %, miss +3.1 % (CGU1 x3); v2 (flag on memo miss only) flat 34/35 CGU1 x3, flat CGU16; v2 made trusted hot gets 4-5 % slower than validating; v3 (trusted pages enter the memo) flat vs v2 on the default path and never slower than validating when trusted."}
{"date": "2026-09-28T12:26:07+00:00", "rung": "maint/copy/compact", "hypothesis": "After the single-write change the compacting copy spent ~31 % in pwrite vs ~13 % walking/packing, serially. LMDB overlaps them with a writer thread (mdb_env_copyfd1).", "outcome": "kept", "commit": "7dc3d1c", "verdict": "improved", "base": "5cb99dd1596d38e06385fcae6c7bed33af0e23c6", "host": "Linux x86_64", "rounds": 3, "rungs": [{"rung": "maint/copy/compact", "state": "improved", "ratio_vs_lmdb_before": 1.5055346009399437, "ratio_vs_lmdb_after": 0.9825754364447129, "speedup": 0.6509296971446326}], "notes": "CGU1 3 rounds 1.51x -> 0.98x (0.651); CGU16 1 round 1.49x -> 0.99x (0.668); raw copy flat. Page-copy compaction (LMDB's other difference) not pursued at parity."}
