{"date": "2026-09-26T16:51:47+00:00", "rung": "put/order/append", "hypothesis": "APPEND copies the last key (to_vec) and builds a fresh path Vec per put; LMDB's APPEND check compares against the in-page key; comparing in place and reusing the path buffer does the same. Expected put/order/append >= 5 % faster.", "outcome": "kept", "commit": "2ee1d25", "verdict": "improved", "base": "60a48329ad838090f7967b73a379c202eedde548", "host": "Linux x86_64", "rounds": 3, "rungs": [{"rung": "put/order/append", "state": "improved", "ratio_vs_lmdb_before": 1.2962608562422016, "ratio_vs_lmdb_after": 1.1594362424090943, "speedup": 0.8944466978430904}], "notes": "CGU1 verdict attached (0.894, 1.30x -> 1.16x); CGU16 ab-20260926T155829Z 0.899 (1.32x -> 1.19x); other put rungs flat in both."}
{"date": "2026-09-27T01:19:26+00:00", "rung": "put/gc/drain_big", "hypothesis": "Every first-touch COW and new page mallocs a fresh 4 KiB Box and every freed/committed frame is freed; LMDB reuses dirty-page buffers via me_dpages within and across txns; a spare-frame list in DirtyStore plus a cross-txn pool (capped at 256 frames, since ZeroDB has no spill) does the same.", "outcome": "reverted", "verdict": "regressed", "base": "57bee9d8c3ec5c51719f6adab3b580c94e78b662", "host": "Linux x86_64", "rounds": 5, "rungs": [{"rung": "env/txn/ro_begin_abort", "state": "flat", "ratio_vs_lmdb_before": 0.6344384877023218, "ratio_vs_lmdb_after": 0.6369848373489854, "speedup": 1.0028657607177662}, {"rung": "env/txn/rw_empty_commit", "state": "regressed", "ratio_vs_lmdb_before": 2.0606796312141094, "ratio_vs_lmdb_after": 2.3990015752838194, "speedup": 1.1529122475952718}], "notes": "Gains real in both builds: put/gc/drain_big 1.62x -> 1.23x (0.76-0.79), put/val/v4k 1.04x -> 1.00x, commit/batch/n1 -3 % at CGU1; target commit/batch/n1 otherwise flat (its +2.3 us is the copy, not the malloc). Reverted for env/txn/rw_empty_commit: v1 (per-frame pool hand-over) 6.1x slower; v2 (O(1) hand-over, separate Mutex) +36 %; v3 (pool under the writer-slot mutex, zero extra lock ops) CGU16 flat but CGU1 +15.3 % over 5 rounds (ab-20260927T010700Z, +-0.098, layout-offset flag). Remaining per-txn work is a few Vec moves + the new Drop for RwTxn; unproven whether code or layout. Patch (v3): attempt-3b-frame-pool.patch. Human call: a ~25 ns/empty-txn cost vs -24 % on GC-heavy writes."}
{"date": "2026-09-27T06:04:44+00:00", "rung": "del/bulk/half", "hypothesis": "new_prevalidated/OverflowRef::new decode the whole CommonHeader (pgno, txnid: bounds-checked loads LLVM cannot drop) just to test flags; LMDB tests the one field; reading only flags removes two loads per page view. Expected get/db/named -1 to -3 % (roadmap #7f).", "outcome": "kept", "commit": "01dcc27", "verdict": "improved", "base": "f481300c8b44578929cd286389d1becfe4d2679e", "host": "Linux x86_64", "rounds": 3, "rungs": [{"rung": "del/bulk/all", "state": "improved", "ratio_vs_lmdb_before": 2.1015288136469485, "ratio_vs_lmdb_after": 1.7694790321973082, "speedup": 0.841996084329956}, {"rung": "del/bulk/half", "state": "improved", "ratio_vs_lmdb_before": 2.0737919082461276, "ratio_vs_lmdb_after": 1.7554107838437376, "speedup": 0.8464739286828181}, {"rung": "del/churn/reinsert", "state": "improved", "ratio_vs_lmdb_before": 1.6024279461982558, "ratio_vs_lmdb_after": 1.4162166892758201, "speedup": 0.8834365502503484}, {"rung": "del/cursor/drain", "state": "improved", "ratio_vs_lmdb_before": 3.5006639620379105, "ratio_vs_lmdb_after": 2.9893905141841537, "speedup": 0.8539495783091049}, {"rung": "del/range/half", "state": "improved", "ratio_vs_lmdb_before": 3.1356278822779426, "ratio_vs_lmdb_after": 2.6521147545170782, "speedup": 0.8561960326985546}, {"rung": "put/api/plain", "state": "improved", "ratio_vs_lmdb_before": 0.9193414143908933, "ratio_vs_lmdb_after": 0.8596286631131367, "speedup": 0.9350483396668047}, {"rung": "put/api/reserved", "state": "improved", "ratio_vs_lmdb_before": 1.046092441062007, "ratio_vs_lmdb_after": 0.9378893333363864, "speedup": 0.8957675024302928}, {"rung": "put/order/append", "state": "improved", "ratio_vs_lmdb_before": 1.1562802325274912, "ratio_vs_lmdb_after": 1.0479409286227854, "speedup": 0.9063035924536312}, {"rung": "put/over/grow", "state": "improved", "ratio_vs_lmdb_before": 1.358134607933555, "ratio_vs_lmdb_after": 1.2236274211475358, "speedup": 0.9046089357121665}, {"rung": "put/over/same_size", "state": "improved", "ratio_vs_lmdb_before": 1.1294779371396224, "ratio_vs_lmdb_after": 1.0504963085205492, "speedup": 0.930289842341882}, {"rung": "put/val/v256", "state": "improved", "ratio_vs_lmdb_before": 0.9725464959806424, "ratio_vs_lmdb_after": 0.9061671630119118, "speedup": 0.9329868038597245}, {"rung": "put/val/v8", "state": "improved", "ratio_vs_lmdb_before": 0.9803087079462871, "ratio_vs_lmdb_after": 0.8742246969292341, "speedup": 0.8917850977379408}], "notes": "Gain landed on the write path (descent builds a view per level): CGU1 put/del 12 improved/0 (del -12..-16 %, put -5..-11 %), CGU16 ab-20260927T052445Z 14/0. Reads CGU1 ab-20260927T020658Z 3 improved/0; CGU16 ab-20260927T042014Z flags scan/meta/len +3.4 % (reproduced) but Database::len is byte-identical at the same address in both builds: harness layout, discounted (PERF-GAP B13 pt 4)."}
{"date": "2026-09-27T09:08:09+00:00", "rung": "get/access/hot", "hypothesis": "Tree::get builds a Cursor (512 B PathStack zero-fill, leaf cache) and re-compares the found key; LMDB's mdb_node_search reports exactness and mdb_cursor_init only resets depth; a cursor-free find_exact that takes exactness from lookup_with does the same. Expected get -3 to -8 % (roadmap #7 a+b).", "outcome": "kept", "commit": "0aa2530", "verdict": "improved", "base": "32c8f6472e6aecd43b7180fe97c9bed01f459a9d", "host": "Linux x86_64", "rounds": 3, "rungs": [{"rung": "get/access/hot", "state": "improved", "ratio_vs_lmdb_before": 1.123994561442055, "ratio_vs_lmdb_after": 0.9270486950937903, "speedup": 0.8243650174202167}, {"rung": "get/access/miss", "state": "improved", "ratio_vs_lmdb_before": 1.3517706200280823, "ratio_vs_lmdb_after": 1.1282209186761376, "speedup": 0.8357619007419114}, {"rung": "get/access/rand", "state": "improved", "ratio_vs_lmdb_before": 1.34969185115924, "ratio_vs_lmdb_after": 1.234507709554674, "speedup": 0.9127418067018147}, {"rung": "get/access/seq", "state": "improved", "ratio_vs_lmdb_before": 1.2354996867330854, "ratio_vs_lmdb_after": 1.0539317223420548, "speedup": 0.8537072227516869}, {"rung": "get/db/named", "state": "improved", "ratio_vs_lmdb_before": 1.3527623010398107, "ratio_vs_lmdb_after": 1.2362094737179872, "speedup": 0.9138408667714689}, {"rung": "get/db/named_x8", "state": "improved", "ratio_vs_lmdb_before": 1.3915743383812127, "ratio_vs_lmdb_after": 1.284017766502403, "speedup": 0.92270871277784}, {"rung": "get/db/root", "state": "improved", "ratio_vs_lmdb_before": 1.3445763406836853, "ratio_vs_lmdb_after": 1.2247100439083332, "speedup": 0.9108519961652733}, {"rung": "get/key/k128", "state": "improved", "ratio_vs_lmdb_before": 1.2858350727064876, "ratio_vs_lmdb_after": 1.1819123995507033, "speedup": 0.923150120386999}, {"rung": "get/key/k32", "state": "improved", "ratio_vs_lmdb_before": 1.3769150284509308, "ratio_vs_lmdb_after": 1.2950715868548208, "speedup": 0.9392473631552899}, {"rung": "get/key/k8", "state": "improved", "ratio_vs_lmdb_before": 1.365301099483146, "ratio_vs_lmdb_after": 1.2440631591796818, "speedup": 0.9112005839961891}, {"rung": "get/size/n1k", "state": "improved", "ratio_vs_lmdb_before": 1.2072517675699568, "ratio_vs_lmdb_after": 1.0110659454661213, "speedup": 0.837493862196837}, {"rung": "get/size/n50k", "state": "improved", "ratio_vs_lmdb_before": 1.3579939409711737, "ratio_vs_lmdb_after": 1.2319167275223304, "speedup": 0.9071592224051613}, {"rung": "get/val/v256", "state": "improved", "ratio_vs_lmdb_before": 1.190668009195146, "ratio_vs_lmdb_after": 1.0536708153314045, "speedup": 0.8837629125821794}, {"rung": "get/val/v2page", "state": "improved", "ratio_vs_lmdb_before": 1.5471420046620767, "ratio_vs_lmdb_after": 1.401571670290614, "speedup": 0.9024062652266203}, {"rung": "get/val/v2page_touch", "state": "improved", "ratio_vs_lmdb_before": 1.3362531563760556, "ratio_vs_lmdb_after": 1.2390248115898692, "speedup": 0.9272380803575637}, {"rung": "get/val/v4k", "state": "improved", "ratio_vs_lmdb_before": 1.580092326453337, "ratio_vs_lmdb_after": 1.44064128743755, "speedup": 0.9079394794734779}, {"rung": "get/val/v4k_touch", "state": "improved", "ratio_vs_lmdb_before": 1.353196515314977, "ratio_vs_lmdb_after": 1.252918296033439, "speedup": 0.9238440091738428}, {"rung": "get/val/v8", "state": "improved", "ratio_vs_lmdb_before": 1.2057983768004732, "ratio_vs_lmdb_after": 1.0447641930982132, "speedup": 0.8658459563389937}, {"rung": "get/val/v8_touch", "state": "improved", "ratio_vs_lmdb_before": 1.208477584334134, "ratio_vs_lmdb_after": 1.0415000499414802, "speedup": 0.8618281906447955}, {"rung": "mixed/rw/8dbs", "state": "improved", "ratio_vs_lmdb_before": 0.9805696283708888, "ratio_vs_lmdb_after": 0.945483512645583, "speedup": 0.9642186391357056}], "notes": "Landed in commit 0aa2530 (with the perf-iterate edits). CGU1 verdict attached: 20 improved / 0 regressed, get/access/hot 1.12x -> 0.93x. CGU16 ab-20260927T075357Z: 20 improved; scan/full/fwd, scan/full/rev, scan/prefix/bucket +3.7-4.4 % flagged, but all Cursor scan functions are byte-identical (shifted 80 B): layout, discounted (PERF-GAP B13 pt 4)."}
{"date": "2026-09-27T09:37:43+00:00", "rung": "get/access/hot", "hypothesis": "bytes_from_classified's map path computes a multi-page high-water cap (try_from + checked_mul + re-slice) on every page load although tree pages need one page; LMDB's mdb_page_get returns one page and the overflow reader handles the run; an exact one-page slice for tree pages, with the cap only on the overflow path, does the same (roadmap #7 d).", "outcome": "reverted", "verdict": "regressed", "base": "79f37ed6afd921075e748963ec95a64b3de9aa5a", "host": "Linux x86_64", "rounds": 1, "rungs": [{"rung": "get/access/hot", "state": "regressed", "ratio_vs_lmdb_before": 0.9455471612409359, "ratio_vs_lmdb_after": 1.1312038118218117, "speedup": 1.1963483770996892}], "notes": "Screen (1 round, CGU1, target only): get/access/hot 1.196 (0.95x -> 1.13x). Reverted at the screen per the fast-pipeline rule. Suspected cause: the split into page_bytes_classified + map_page/map_run helpers moved the hot descent past LLVM's inlining threshold (PERF-GAP B13); an nm diff of CGU1 builds would confirm. Patch kept: research/next-7d-exact-page-slice.patch (caller audit + SPEC TXN-38 amendment inside)."}
{"date": "2026-09-27T09:58:45+00:00", "rung": "put/gc/drain_big", "hypothesis": "Per-page 4 KiB Box malloc/free on every COW and new page; LMDB reuses buffers via me_dpages within and across txns; a capped spare-frame list carried in the writer slot does the same.", "outcome": "kept", "commit": "36e9803", "verdict": "regressed", "base": "79f37ed6afd921075e748963ec95a64b3de9aa5a", "host": "Linux x86_64", "rounds": 3, "rungs": [{"rung": "commit/batch/n1", "state": "improved", "ratio_vs_lmdb_before": 2.052016583716212, "ratio_vs_lmdb_after": 1.9266684270102725, "speedup": 0.9519161560300988}, {"rung": "env/txn/rw_empty_commit", "state": "regressed", "ratio_vs_lmdb_before": 2.191644048222265, "ratio_vs_lmdb_after": 2.4103560315222152, "speedup": 1.099897851997866}, {"rung": "put/gc/drain_big", "state": "improved", "ratio_vs_lmdb_before": 1.5781642008968024, "ratio_vs_lmdb_after": 1.171393928251267, "speedup": 0.741855361455176}, {"rung": "put/val/v4k", "state": "improved", "ratio_vs_lmdb_before": 1.040739585728799, "ratio_vs_lmdb_after": 0.999719175363571, "speedup": 0.9605853270811231}], "notes": "Maintainer override (Quentin, 2026-09-27: 'yes keep it') of the f481300 revert. Re-check on top of B17 (CGU1, verdict attached): put/gc/drain_big 0.742, commit/batch/n1 0.952, put/val/v4k 0.961, env/txn/rw_empty_commit 1.100 (the accepted cost). Gate: local fmt/clippy/test/miri/fuzz + server crash/stress green."}
{"date": "2026-09-27T10:19:32+00:00", "rung": "scan/full/fwd", "hypothesis": "ascend_next/ascend_prev re-resolve the parent branch view at every leaf boundary although it repeats for ~fanout leaves; LMDB keeps mc_pg[] resolved and moves via mdb_cursor_sibling; one cached parent BranchRef in Cursor does the same (roadmap #7 c).", "outcome": "reverted", "verdict": "flat", "base": "79f37ed6afd921075e748963ec95a64b3de9aa5a", "host": "Linux x86_64", "rounds": 3, "rungs": [{"rung": "scan/full/fwd", "state": "flat", "ratio_vs_lmdb_before": 1.6637482418711016, "ratio_vs_lmdb_after": 1.5966502910696103, "speedup": 0.9596706105449999}, {"rung": "scan/meta/len", "state": "improved", "ratio_vs_lmdb_before": 1.1493622052320263, "ratio_vs_lmdb_after": 1.0497475826111438, "speedup": 0.9133305217733579}, {"rung": "scan/range/10pct", "state": "improved", "ratio_vs_lmdb_before": 1.8684859057303025, "ratio_vs_lmdb_after": 1.8034627038071525, "speedup": 0.9657229682901431}], "notes": "Screen 0.956 (LMDB drift). Full CGU1 3 rounds: target scan/full/fwd 0.960 +-0.093 flat; scan/full/rev 0.977, scan/range/10pct 0.966, scan/prefix 0.978 - a consistent 2-4 % but under the bar; nothing regressed. The branch re-resolution is a memo hit, so the per-boundary cost it saves is small. CGU16 run not done (local disk full). Patch kept: research/next-7c-parent-branch-cache.patch."}
{"date": "2026-09-27T12:22:22+00:00", "rung": "get/key/k8", "hypothesis": "Every binary-search probe with the default comparator calls memcmp; equal-length 8/4-byte keys (BE u64/u32 ids) can compare as one integer, which is exactly memcmp order (Masstree key slices). Expected get/key/k8 -3..-6 % (roadmap #7 e).", "outcome": "reverted", "verdict": "regressed", "base": "b7fa519282c7089ba3fcfcb99b86a78f9a9c803e", "host": "Linux x86_64", "rounds": 3, "rungs": [{"rung": "get/access/hot", "state": "improved", "ratio_vs_lmdb_before": 0.9251517417568982, "ratio_vs_lmdb_after": 0.769765587398416, "speedup": 0.8320425208697139}, {"rung": "get/access/miss", "state": "improved", "ratio_vs_lmdb_before": 1.1257098674531842, "ratio_vs_lmdb_after": 0.9576434985890463, "speedup": 0.8524344286159138}, {"rung": "get/access/seq", "state": "improved", "ratio_vs_lmdb_before": 1.0309421061333368, "ratio_vs_lmdb_after": 0.9094195475689806, "speedup": 0.8821247499336892}, {"rung": "get/db/named", "state": "improved", "ratio_vs_lmdb_before": 1.238942829980729, "ratio_vs_lmdb_after": 1.1742347600286018, "speedup": 0.9506137135928336}, {"rung": "get/key/k128", "state": "regressed", "ratio_vs_lmdb_before": 1.2037942892656355, "ratio_vs_lmdb_after": 1.263414337601617, "speedup": 1.0512551456866683}, {"rung": "get/key/k8", "state": "improved", "ratio_vs_lmdb_before": 1.2427953110538523, "ratio_vs_lmdb_after": 1.1432659295030583, "speedup": 0.9199149041957712}, {"rung": "get/size/n1k", "state": "improved", "ratio_vs_lmdb_before": 0.9978609862047076, "ratio_vs_lmdb_after": 0.9245385854804485, "speedup": 0.9253765497727009}, {"rung": "get/size/n50k", "state": "improved", "ratio_vs_lmdb_before": 1.2323498680722156, "ratio_vs_lmdb_after": 1.125913711189278, "speedup": 0.9136315427619291}, {"rung": "get/val/v256", "state": "improved", "ratio_vs_lmdb_before": 1.0433074572810606, "ratio_vs_lmdb_after": 0.9577592073314293, "speedup": 0.9222718767171894}, {"rung": "get/val/v2page", "state": "improved", "ratio_vs_lmdb_before": 1.3708164112156755, "ratio_vs_lmdb_after": 1.266420344935353, "speedup": 0.9232060361217096}, {"rung": "get/val/v2page_touch", "state": "improved", "ratio_vs_lmdb_before": 1.2194237608722418, "ratio_vs_lmdb_after": 1.147133996516271, "speedup": 0.9412922135974325}, {"rung": "get/val/v4k", "state": "improved", "ratio_vs_lmdb_before": 1.4172733158086472, "ratio_vs_lmdb_after": 1.307801278052154, "speedup": 0.9265055449509412}, {"rung": "get/val/v4k_touch", "state": "improved", "ratio_vs_lmdb_before": 1.2404124245822516, "ratio_vs_lmdb_after": 1.160210455737107, "speedup": 0.9353779248208353}, {"rung": "get/val/v8", "state": "improved", "ratio_vs_lmdb_before": 1.0152170610998406, "ratio_vs_lmdb_after": 0.9136077168510254, "speedup": 0.8999136754668642}, {"rung": "get/val/v8_touch", "state": "improved", "ratio_vs_lmdb_before": 1.016140345698783, "ratio_vs_lmdb_after": 0.909524956324882, "speedup": 0.8987606379884996}, {"rung": "put/api/plain", "state": "improved", "ratio_vs_lmdb_before": 0.9185440320581495, "ratio_vs_lmdb_after": 0.865016786895666, "speedup": 0.9428369581697988}, {"rung": "put/api/reserved", "state": "improved", "ratio_vs_lmdb_before": 0.9659481186723127, "ratio_vs_lmdb_after": 0.9344551414110763, "speedup": 0.9678287374324044}, {"rung": "put/order/rand", "state": "improved", "ratio_vs_lmdb_before": 1.0281543384105338, "ratio_vs_lmdb_after": 0.9860027514144284, "speedup": 0.964126812805615}, {"rung": "put/order/seq", "state": "improved", "ratio_vs_lmdb_before": 0.91913753734747, "ratio_vs_lmdb_after": 0.8640857633274119, "speedup": 0.9401049660326882}, {"rung": "seek/ge/rand", "state": "improved", "ratio_vs_lmdb_before": 1.1912470752377926, "ratio_vs_lmdb_after": 1.1089899337118942, "speedup": 0.9310756455426273}, {"rung": "seek/ge/seq", "state": "improved", "ratio_vs_lmdb_before": 1.291618848796388, "ratio_vs_lmdb_after": 1.2099692253825685, "speedup": 0.9367850480891435}], "notes": "Gate green (local: fmt/clippy/test/miri/fuzz). CGU1 3 rounds: 20 improved, 1 regressed - get/access/hot 0.93x -> 0.77x, get/val/v8 1.02x -> 0.91x, put/order/seq 0.92x -> 0.86x; get/key/k128 +5.1 %. CGU16 1 round (ab-20260927T115301Z): 25 improved, get/key/k128 +4.4 %. The k128 cost is real (both builds): long keys pay the length dispatch. Caveat: most bench rungs use 8-byte keys, so the win is overstated for word/string keys. Reverted per rule; NEEDS QUENTIN'S CALL (trade-off, like the frame pool). Patch: research/next-7e-int-key-compare.patch. Third consecutive revert -> loop stopped."}
