{"date": "2026-09-30T01:59:42+00:00", "rung": "^(get|seek|scan)/", "hypothesis": "ADR-0018: an env-wide cache of validated page versions keyed by (pgno, kind, header txnid stamp) lets short read txns skip re-validating pages an earlier txn validated.", "outcome": "kept", "commit": "d8a2f79", "verdict": "improved", "base": "df50c1a19cdd8cd2f6c0c0c2b23b38520d915127", "host": "Linux x86_64", "rounds": 3, "rungs": [{"rung": "commit/batch/n1", "state": "flat", "ratio_vs_lmdb_before": 1.9312926993317285, "ratio_vs_lmdb_after": 1.9452459777781943, "speedup": 1.00099095762371}, {"rung": "commit/batch/n100", "state": "flat", "ratio_vs_lmdb_before": 1.0997248583014352, "ratio_vs_lmdb_after": 1.081296837531664, "speedup": 0.9795289271510382}, {"rung": "commit/batch/n10k", "state": "flat", "ratio_vs_lmdb_before": 0.897268030389953, "ratio_vs_lmdb_after": 0.8967360338749453, "speedup": 0.9993778486206281}, {"rung": "commit/sync/n1", "state": "flat", "ratio_vs_lmdb_before": 0.9906522482337298, "ratio_vs_lmdb_after": 0.9404082927306264, "speedup": 0.9492819447059397}, {"rung": "commit/sync/n100", "state": "unreliable", "ratio_vs_lmdb_before": 0.8676651665785976, "ratio_vs_lmdb_after": 0.9079269565152894, "speedup": 1.046402450493032}, {"rung": "del/bulk/all", "state": "improved", "ratio_vs_lmdb_before": 1.7377322779642708, "ratio_vs_lmdb_after": 1.6593145467946822, "speedup": 0.9549698130534169}, {"rung": "del/bulk/half", "state": "flat", "ratio_vs_lmdb_before": 1.733642672791599, "ratio_vs_lmdb_after": 1.6475654601351788, "speedup": 0.9559563717226798}, {"rung": "del/churn/reinsert", "state": "flat", "ratio_vs_lmdb_before": 1.3724285950058148, "ratio_vs_lmdb_after": 1.3722447111536755, "speedup": 0.9942663144481295}, {"rung": "del/clear/all", "state": "flat", "ratio_vs_lmdb_before": 1.8424928410423258, "ratio_vs_lmdb_after": 1.7848510067086514, "speedup": 0.9628739362851368}, {"rung": "del/cursor/drain", "state": "flat", "ratio_vs_lmdb_before": 2.695500194073221, "ratio_vs_lmdb_after": 2.6508818217666357, "speedup": 0.9803133494073349}, {"rung": "del/range/half", "state": "flat", "ratio_vs_lmdb_before": 0.932529844016681, "ratio_vs_lmdb_after": 0.9280750018240418, "speedup": 1.0029098404862469}, {"rung": "env/open/create", "state": "flat", "ratio_vs_lmdb_before": 8.453714194059211, "ratio_vs_lmdb_after": 8.387453932445855, "speedup": 0.9824159253805017}, {"rung": "env/open/reopen", "state": "flat", "ratio_vs_lmdb_before": 0.3296970275696362, "ratio_vs_lmdb_after": 0.3191999719932978, "speedup": 0.9290009313441485}, {"rung": "env/stat/non_free", "state": "flat", "ratio_vs_lmdb_before": 0.40240694653003317, "ratio_vs_lmdb_after": 0.405199994897631, "speedup": 1.0069408552503438}, {"rung": "env/txn/ro_begin_abort", "state": "unreliable", "ratio_vs_lmdb_before": 0.5555859438202029, "ratio_vs_lmdb_after": 0.5549027961557813, "speedup": 0.9987747173185871}, {"rung": "env/txn/rw_empty_commit", "state": "flat", "ratio_vs_lmdb_before": 2.47303906853904, "ratio_vs_lmdb_after": 2.4109673603435247, "speedup": 0.9749006358269202}, {"rung": "get/access/hot", "state": "flat", "ratio_vs_lmdb_before": 0.783636693127179, "ratio_vs_lmdb_after": 0.7676993827204309, "speedup": 0.9781429243249217}, {"rung": "get/access/miss", "state": "flat", "ratio_vs_lmdb_before": 0.989160469140749, "ratio_vs_lmdb_after": 0.9662613330948013, "speedup": 0.9754934382887318}, {"rung": "get/access/rand", "state": "improved", "ratio_vs_lmdb_before": 1.1578451911534924, "ratio_vs_lmdb_after": 0.9424897146461928, "speedup": 0.814003220678618}, {"rung": "get/access/seq", "state": "improved", "ratio_vs_lmdb_before": 0.9383922114943023, "ratio_vs_lmdb_after": 0.8825838568371943, "speedup": 0.9402106701019918}, {"rung": "get/db/named", "state": "improved", "ratio_vs_lmdb_before": 1.1543348629124113, "ratio_vs_lmdb_after": 0.9471996316359242, "speedup": 0.8194047742599951}, {"rung": "get/db/named_x8", "state": "improved", "ratio_vs_lmdb_before": 1.2119002813734416, "ratio_vs_lmdb_after": 1.0354747516171132, "speedup": 0.8544224038331057}, {"rung": "get/db/root", "state": "improved", "ratio_vs_lmdb_before": 1.1461055760276215, "ratio_vs_lmdb_after": 0.943583838857692, "speedup": 0.8174890878953736}, {"rung": "get/key/k128", "state": "improved", "ratio_vs_lmdb_before": 1.2709310136133598, "ratio_vs_lmdb_after": 1.147505840676005, "speedup": 0.9033663679933371}, {"rung": "get/key/k32", "state": "improved", "ratio_vs_lmdb_before": 1.3399639578057092, "ratio_vs_lmdb_after": 1.1545720663706367, "speedup": 0.8609013101857068}, {"rung": "get/key/k8", "state": "improved", "ratio_vs_lmdb_before": 1.1618797557242, "ratio_vs_lmdb_after": 0.9451007348566886, "speedup": 0.8137436838173986}, {"rung": "get/size/n1k", "state": "improved", "ratio_vs_lmdb_before": 0.9509089290154845, "ratio_vs_lmdb_after": 0.9230023625221239, "speedup": 0.9692366606391721}, {"rung": "get/size/n50k", "state": "improved", "ratio_vs_lmdb_before": 1.1576500673062993, "ratio_vs_lmdb_after": 0.959702233430075, "speedup": 0.8282692537490809}, {"rung": "get/val/v256", "state": "improved", "ratio_vs_lmdb_before": 0.9769192292260445, "ratio_vs_lmdb_after": 0.9293075176874956, "speedup": 0.9545953128571537}, {"rung": "get/val/v2page", "state": "flat", "ratio_vs_lmdb_before": 1.303113127858797, "ratio_vs_lmdb_after": 1.2586254083521864, "speedup": 0.9726145403801063}, {"rung": "get/val/v2page_touch", "state": "flat", "ratio_vs_lmdb_before": 1.1700030647831154, "ratio_vs_lmdb_after": 1.13685611342176, "speedup": 0.973849093293628}, {"rung": "get/val/v4k", "state": "improved", "ratio_vs_lmdb_before": 1.3628914385492839, "ratio_vs_lmdb_after": 1.2934778291840823, "speedup": 0.9493134349734773}, {"rung": "get/val/v4k_touch", "state": "improved", "ratio_vs_lmdb_before": 1.1819353519685298, "ratio_vs_lmdb_after": 1.144553334829419, "speedup": 0.9691177150379777}, {"rung": "get/val/v8", "state": "improved", "ratio_vs_lmdb_before": 0.9314345686874917, "ratio_vs_lmdb_after": 0.8903964634294111, "speedup": 0.9555760010492008}, {"rung": "get/val/v8_touch", "state": "improved", "ratio_vs_lmdb_before": 0.9357851712902888, "ratio_vs_lmdb_after": 0.8920734587992316, "speedup": 0.9534701277605292}, {"rung": "maint/copy/compact", "state": "flat", "ratio_vs_lmdb_before": 0.9831425219808995, "ratio_vs_lmdb_after": 0.9839972166928941, "speedup": 1.001289844227441}, {"rung": "maint/copy/raw", "state": "flat", "ratio_vs_lmdb_before": 0.9321624860333441, "ratio_vs_lmdb_after": 0.9389039162720342, "speedup": 1.005868185186401}, {"rung": "mixed/rw/8dbs", "state": "flat", "ratio_vs_lmdb_before": 0.9308587453992505, "ratio_vs_lmdb_after": 0.9327400132651581, "speedup": 1.0020210025153717}, {"rung": "put/api/plain", "state": "flat", "ratio_vs_lmdb_before": 0.8728950618575236, "ratio_vs_lmdb_after": 0.8694187017217416, "speedup": 0.9995141671996224}, {"rung": "put/api/reserved", "state": "flat", "ratio_vs_lmdb_before": 0.936245355764287, "ratio_vs_lmdb_after": 0.9382895187147255, "speedup": 1.0021833624464496}, {"rung": "put/gc/drain_big", "state": "flat", "ratio_vs_lmdb_before": 1.1504706604913917, "ratio_vs_lmdb_after": 1.152876971576735, "speedup": 1.0020915883976698}, {"rung": "put/order/append", "state": "flat", "ratio_vs_lmdb_before": 1.133871291186866, "ratio_vs_lmdb_after": 1.1370402686428556, "speedup": 1.0027948299605263}, {"rung": "put/order/rand", "state": "flat", "ratio_vs_lmdb_before": 0.9696291747225046, "ratio_vs_lmdb_after": 0.9731425309908118, "speedup": 0.9999631751181197}, {"rung": "put/order/seq", "state": "flat", "ratio_vs_lmdb_before": 0.8701636280438605, "ratio_vs_lmdb_after": 0.869804302208331, "speedup": 0.99521106183726}, {"rung": "put/over/grow", "state": "flat", "ratio_vs_lmdb_before": 1.240057324134665, "ratio_vs_lmdb_after": 1.2414449002683607, "speedup": 1.0019292775896023}, {"rung": "put/over/same_size", "state": "flat", "ratio_vs_lmdb_before": 1.026858191716869, "ratio_vs_lmdb_after": 1.025998265981817, "speedup": 1.0009208880138836}, {"rung": "put/val/v256", "state": "flat", "ratio_vs_lmdb_before": 0.8856803533946509, "ratio_vs_lmdb_after": 0.8849462774218066, "speedup": 1.0011142298719333}, {"rung": "put/val/v2page", "state": "flat", "ratio_vs_lmdb_before": 1.023188886960281, "ratio_vs_lmdb_after": 1.0157951605000968, "speedup": 0.9931733182320798}, {"rung": "put/val/v4k", "state": "flat", "ratio_vs_lmdb_before": 1.0057912450421505, "ratio_vs_lmdb_after": 1.004741509614368, "speedup": 0.9974268744224343}, {"rung": "put/val/v8", "state": "flat", "ratio_vs_lmdb_before": 0.8354121519456071, "ratio_vs_lmdb_after": 0.8349528018577315, "speedup": 0.9998659571374249}, {"rung": "scan/edge/first_last", "state": "flat", "ratio_vs_lmdb_before": 1.5297327862894585, "ratio_vs_lmdb_after": 1.5324159776165787, "speedup": 1.0017540261614113}, {"rung": "scan/full/fwd", "state": "improved", "ratio_vs_lmdb_before": 1.7125102379543682, "ratio_vs_lmdb_after": 1.4947141248481224, "speedup": 0.8728205482926583}, {"rung": "scan/full/rev", "state": "improved", "ratio_vs_lmdb_before": 1.658876876802252, "ratio_vs_lmdb_after": 1.464577964519029, "speedup": 0.8827686952786741}, {"rung": "scan/meta/len", "state": "flat", "ratio_vs_lmdb_before": 1.1880463721871846, "ratio_vs_lmdb_after": 1.0932355902960529, "speedup": 0.9202388960146599}, {"rung": "scan/prefix/bucket", "state": "improved", "ratio_vs_lmdb_before": 2.2801125876530204, "ratio_vs_lmdb_after": 1.7609121155959484, "speedup": 0.772284769172501}, {"rung": "scan/range/10pct", "state": "improved", "ratio_vs_lmdb_before": 1.652393491553555, "ratio_vs_lmdb_after": 1.3026798424278085, "speedup": 0.7866601122314757}, {"rung": "scan/range/1pct", "state": "improved", "ratio_vs_lmdb_before": 1.701213319792264, "ratio_vs_lmdb_after": 1.3309341494437623, "speedup": 0.7804841979166482}, {"rung": "seek/ge/gap", "state": "improved", "ratio_vs_lmdb_before": 1.3066782569594224, "ratio_vs_lmdb_after": 1.11293278994066, "speedup": 0.8509398638999313}, {"rung": "seek/ge/rand", "state": "improved", "ratio_vs_lmdb_before": 1.1485054395038583, "ratio_vs_lmdb_after": 0.952312548640074, "speedup": 0.8331088393360618}, {"rung": "seek/ge/seq", "state": "improved", "ratio_vs_lmdb_before": 1.1945036708761751, "ratio_vs_lmdb_after": 0.9454940125686091, "speedup": 0.7914591273315112}], "notes": "Full ladder CGU1 3 rounds: 24 faster, 0 slower; CGU16: 25 faster, flagged reopen/commit-sync flat on 3-round re-run. short_txn_census read txn+get 1984 -> 1008 ns (LMDB 649). YCSB B 2G cap: read p50 2.3 -> 1.1 us, ops/s +1.5 % (disk-bound). Dropped shapes: Arc per txn (ro_begin_abort +17 %), writers (put/val/v8 +12 %), two-word handle (CGU16 scan/full +7 %), owning variant (ro_begin_abort +7 %), hashed slots (scan/full +5 %), branch-only (no gain)."}
{"date": "2026-09-30T20:33:17+00:00", "rung": "^(del|put|commit|get|scan|seek|env)/", "hypothesis": "ADR-0017: spilling a write txn's dirty pages past LMDB's limit bounds its memory like LMDB's, freeing RAM for the page cache in bigger-than-RAM workloads, with nothing changing below the limit.", "outcome": "kept", "commit": "629e945", "verdict": "regressed", "base": "2753faa4e0d198d4e8c4e4c645764a985b6ab234", "host": "Linux x86_64", "rounds": 3, "rungs": [{"rung": "commit/batch/n1", "state": "flat", "ratio_vs_lmdb_before": 1.9797135801277104, "ratio_vs_lmdb_after": 1.9830479101085066, "speedup": 1.002492826714986}, {"rung": "commit/batch/n100", "state": "flat", "ratio_vs_lmdb_before": 1.0741812681140122, "ratio_vs_lmdb_after": 1.0889745001679227, "speedup": 1.0082997687634072}, {"rung": "commit/batch/n10k", "state": "flat", "ratio_vs_lmdb_before": 0.8887229762954105, "ratio_vs_lmdb_after": 0.8980374790628098, "speedup": 1.007386112716216}, {"rung": "commit/sync/n1", "state": "unreliable", "ratio_vs_lmdb_before": 0.9431284935472107, "ratio_vs_lmdb_after": 1.0085698623458108, "speedup": 1.0567024231402677}, {"rung": "commit/sync/n100", "state": "flat", "ratio_vs_lmdb_before": 0.9893132061943495, "ratio_vs_lmdb_after": 0.9460838760147394, "speedup": 0.9739540899217846}, {"rung": "del/bulk/all", "state": "flat", "ratio_vs_lmdb_before": 1.6376298659864115, "ratio_vs_lmdb_after": 1.6700051867056953, "speedup": 1.0218013162483128}, {"rung": "del/bulk/half", "state": "flat", "ratio_vs_lmdb_before": 1.6328078457382704, "ratio_vs_lmdb_after": 1.6610794467623942, "speedup": 1.0198297997731405}, {"rung": "del/churn/reinsert", "state": "flat", "ratio_vs_lmdb_before": 1.345821229424245, "ratio_vs_lmdb_after": 1.355300401901681, "speedup": 1.0091543020117304}, {"rung": "del/clear/all", "state": "flat", "ratio_vs_lmdb_before": 1.7993134707633136, "ratio_vs_lmdb_after": 1.833483151382149, "speedup": 1.0189903989349558}, {"rung": "del/cursor/drain", "state": "regressed", "ratio_vs_lmdb_before": 2.571405190924291, "ratio_vs_lmdb_after": 2.6740118891735913, "speedup": 1.0420886947855497}, {"rung": "del/range/half", "state": "regressed", "ratio_vs_lmdb_before": 0.9142388307505223, "ratio_vs_lmdb_after": 0.9586629695655948, "speedup": 1.0485913935405737}, {"rung": "env/open/create", "state": "flat", "ratio_vs_lmdb_before": 8.93720635853628, "ratio_vs_lmdb_after": 9.2418346884173, "speedup": 1.0343803175229382}, {"rung": "env/open/reopen", "state": "flat", "ratio_vs_lmdb_before": 0.32149498852431063, "ratio_vs_lmdb_after": 0.32180527260068353, "speedup": 1.0034644663546284}, {"rung": "env/stat/non_free", "state": "flat", "ratio_vs_lmdb_before": 0.41348249723325126, "ratio_vs_lmdb_after": 0.4118280033663144, "speedup": 0.995998636271166}, {"rung": "env/txn/ro_begin_abort", "state": "unreliable", "ratio_vs_lmdb_before": 0.567041460628582, "ratio_vs_lmdb_after": 0.5703029717820751, "speedup": 1.0057450458612334}, {"rung": "env/txn/rw_empty_commit", "state": "unreliable", "ratio_vs_lmdb_before": 2.5390945474450306, "ratio_vs_lmdb_after": 2.566290558765398, "speedup": 1.0152106589733627}, {"rung": "get/access/hot", "state": "flat", "ratio_vs_lmdb_before": 0.7637806554021295, "ratio_vs_lmdb_after": 0.7665080218151479, "speedup": 1.0035708765255158}, {"rung": "get/access/miss", "state": "flat", "ratio_vs_lmdb_before": 0.961737538537421, "ratio_vs_lmdb_after": 0.9545704431980625, "speedup": 0.9983446502286827}, {"rung": "get/access/rand", "state": "unreliable", "ratio_vs_lmdb_before": 0.9549121107062927, "ratio_vs_lmdb_after": 0.9356583636917788, "speedup": 1.0005352850914249}, {"rung": "get/access/seq", "state": "flat", "ratio_vs_lmdb_before": 0.8828859602936934, "ratio_vs_lmdb_after": 0.8957656580966296, "speedup": 1.0139036165541395}, {"rung": "get/db/named", "state": "flat", "ratio_vs_lmdb_before": 0.973083803621757, "ratio_vs_lmdb_after": 0.9735264065569963, "speedup": 1.0004548456500786}, {"rung": "get/db/named_x8", "state": "flat", "ratio_vs_lmdb_before": 1.0237942215064157, "ratio_vs_lmdb_after": 1.0267635699227873, "speedup": 0.9904526041047341}, {"rung": "get/db/root", "state": "flat", "ratio_vs_lmdb_before": 0.9392401316007274, "ratio_vs_lmdb_after": 0.9962018310186935, "speedup": 1.0599056225207444}, {"rung": "get/key/k128", "state": "flat", "ratio_vs_lmdb_before": 1.1420725687641806, "ratio_vs_lmdb_after": 1.1376323225342162, "speedup": 0.9961121155070126}, {"rung": "get/key/k32", "state": "flat", "ratio_vs_lmdb_before": 1.1903784223788973, "ratio_vs_lmdb_after": 1.1015743498179695, "speedup": 0.9309151211062079}, {"rung": "get/key/k8", "state": "flat", "ratio_vs_lmdb_before": 0.9726139233848512, "ratio_vs_lmdb_after": 0.9400076768578277, "speedup": 0.964593878040312}, {"rung": "get/size/n1k", "state": "flat", "ratio_vs_lmdb_before": 0.9041799662034684, "ratio_vs_lmdb_after": 0.9163447048567217, "speedup": 1.0141451672822497}, {"rung": "get/size/n50k", "state": "flat", "ratio_vs_lmdb_before": 0.9828175917020545, "ratio_vs_lmdb_after": 0.9924233179872859, "speedup": 1.0127425806741714}, {"rung": "get/val/v256", "state": "flat", "ratio_vs_lmdb_before": 0.9236598906494684, "ratio_vs_lmdb_after": 0.9340107149519482, "speedup": 1.0113909652407067}, {"rung": "get/val/v2page", "state": "flat", "ratio_vs_lmdb_before": 1.256930226935879, "ratio_vs_lmdb_after": 1.2460197848187609, "speedup": 0.9885151776328804}, {"rung": "get/val/v2page_touch", "state": "flat", "ratio_vs_lmdb_before": 1.1372077816179273, "ratio_vs_lmdb_after": 1.132799376243278, "speedup": 0.9961234829325759}, {"rung": "get/val/v4k", "state": "flat", "ratio_vs_lmdb_before": 1.2752430925952143, "ratio_vs_lmdb_after": 1.2760463745326625, "speedup": 1.0020512089191833}, {"rung": "get/val/v4k_touch", "state": "flat", "ratio_vs_lmdb_before": 1.1417212621546715, "ratio_vs_lmdb_after": 1.1409418142086132, "speedup": 0.9972167648787498}, {"rung": "get/val/v8", "state": "flat", "ratio_vs_lmdb_before": 0.8756582471411251, "ratio_vs_lmdb_after": 0.8868908159855377, "speedup": 1.0158427417526041}, {"rung": "get/val/v8_touch", "state": "flat", "ratio_vs_lmdb_before": 0.8829421020425434, "ratio_vs_lmdb_after": 0.8871985262783391, "speedup": 1.0028466480652596}, {"rung": "maint/copy/compact", "state": "flat", "ratio_vs_lmdb_before": 0.9787695105337003, "ratio_vs_lmdb_after": 0.9812279988115796, "speedup": 1.0026147570914332}, {"rung": "maint/copy/raw", "state": "flat", "ratio_vs_lmdb_before": 0.9376301854279105, "ratio_vs_lmdb_after": 0.9342343591275141, "speedup": 0.9983530101469171}, {"rung": "mixed/rw/8dbs", "state": "flat", "ratio_vs_lmdb_before": 0.9288725358502915, "ratio_vs_lmdb_after": 0.9342432458279205, "speedup": 1.0096795123293665}, {"rung": "put/api/plain", "state": "flat", "ratio_vs_lmdb_before": 0.870364457415325, "ratio_vs_lmdb_after": 0.8773611569217454, "speedup": 1.0041597534801916}, {"rung": "put/api/reserved", "state": "flat", "ratio_vs_lmdb_before": 0.9374024035942091, "ratio_vs_lmdb_after": 0.9406334080870643, "speedup": 1.0034467636102349}, {"rung": "put/gc/drain_big", "state": "flat", "ratio_vs_lmdb_before": 1.144976188596213, "ratio_vs_lmdb_after": 1.159410435773083, "speedup": 1.0126065915786135}, {"rung": "put/order/append", "state": "flat", "ratio_vs_lmdb_before": 1.1290492636045735, "ratio_vs_lmdb_after": 1.1384526994583497, "speedup": 1.0110102634480762}, {"rung": "put/order/rand", "state": "flat", "ratio_vs_lmdb_before": 0.9612982543205233, "ratio_vs_lmdb_after": 0.9612105628453818, "speedup": 0.9978104596940905}, {"rung": "put/order/seq", "state": "flat", "ratio_vs_lmdb_before": 0.8687774093593242, "ratio_vs_lmdb_after": 0.8763186483392705, "speedup": 1.0075072252824775}, {"rung": "put/over/grow", "state": "flat", "ratio_vs_lmdb_before": 1.2414830799646766, "ratio_vs_lmdb_after": 1.2276256484552628, "speedup": 0.9876829776717914}, {"rung": "put/over/same_size", "state": "flat", "ratio_vs_lmdb_before": 1.0194685343607592, "ratio_vs_lmdb_after": 1.022115846549621, "speedup": 1.0025382036602237}, {"rung": "put/val/v256", "state": "flat", "ratio_vs_lmdb_before": 0.8856620109347652, "ratio_vs_lmdb_after": 0.8867699544758739, "speedup": 1.001250977830628}, {"rung": "put/val/v2page", "state": "flat", "ratio_vs_lmdb_before": 1.008137129863922, "ratio_vs_lmdb_after": 1.0256817027434741, "speedup": 1.0183918629438349}, {"rung": "put/val/v4k", "state": "flat", "ratio_vs_lmdb_before": 1.00117214889368, "ratio_vs_lmdb_after": 1.0101051463322865, "speedup": 1.009728948702096}, {"rung": "put/val/v8", "state": "flat", "ratio_vs_lmdb_before": 0.8365739215857217, "ratio_vs_lmdb_after": 0.8271561286790112, "speedup": 0.9867424270361694}, {"rung": "scan/edge/first_last", "state": "flat", "ratio_vs_lmdb_before": 1.536350186371385, "ratio_vs_lmdb_after": 1.5290433476627232, "speedup": 0.9949663258141225}, {"rung": "scan/full/fwd", "state": "flat", "ratio_vs_lmdb_before": 1.5028609055890827, "ratio_vs_lmdb_after": 1.5369398485075303, "speedup": 1.0226760459279427}, {"rung": "scan/full/rev", "state": "flat", "ratio_vs_lmdb_before": 1.4723663650311203, "ratio_vs_lmdb_after": 1.4632499778118333, "speedup": 0.9929113550914659}, {"rung": "scan/meta/len", "state": "regressed", "ratio_vs_lmdb_before": 1.149870237268471, "ratio_vs_lmdb_after": 1.2492809903812045, "speedup": 1.086516631945899}, {"rung": "scan/prefix/bucket", "state": "flat", "ratio_vs_lmdb_before": 1.7890626749226926, "ratio_vs_lmdb_after": 1.8004814136902068, "speedup": 1.0061686802234464}, {"rung": "scan/range/10pct", "state": "flat", "ratio_vs_lmdb_before": 1.3229125428238986, "ratio_vs_lmdb_after": 1.3620253659388244, "speedup": 1.019168421655685}, {"rung": "scan/range/1pct", "state": "flat", "ratio_vs_lmdb_before": 1.3614954132117196, "ratio_vs_lmdb_after": 1.3912736701357855, "speedup": 1.0108886467961613}, {"rung": "seek/ge/gap", "state": "flat", "ratio_vs_lmdb_before": 1.1094709449343667, "ratio_vs_lmdb_after": 1.0930291378320705, "speedup": 0.9827918837326329}, {"rung": "seek/ge/rand", "state": "flat", "ratio_vs_lmdb_before": 0.9327119792087041, "ratio_vs_lmdb_after": 0.948395516263395, "speedup": 0.9975717124652425}, {"rung": "seek/ge/seq", "state": "flat", "ratio_vs_lmdb_before": 0.946216439582972, "ratio_vs_lmdb_after": 0.9387828574028461, "speedup": 0.9921438881537483}], "notes": "Ladder CGU1 3 rounds: flagged del/cursor/drain, del/range/half flat on 3-round re-run; del/clear/all fixed (range test before spilled lookup); page-count division -> shift (del/* 0.968-1.028); scan/meta/len alignment quantum (64.1/70.2/76.2 us across builds; 1.000 final). CGU16: flagged rungs flat on 3 rounds except scan/meta/len +3.2 % (same quantum). Dropped: spilled-page lookup inside force-inlined resolution (read rungs +3..13 %). YCSB 2 GB cap: C completes 0.87x (539 vs 520 MiB anon), A 0.58x -> 0.76x, B 0.31x -> 0.69x."}
